7,"доска Greenline Дуб Карамель","Greenline Дуб Карамель"
9,"доска Mazarri Ясень Какао","Mazarri Ясень Какао"
8,"доска Mazarri Ясень Коньяк","Mazarri Ясень Коньяк"
10,"доска Mazarri Ясень Антик","Mazarri Ясень Антик"
11,"доска Mazarri Ясень Песочный","Mazarri Ясень Песочный"
12,"доска Mazarri Дуб Коньяк","Mazarri Дуб Коньяк"
13,"доска Polarwood Дуб Ливинг","Polarwood Дуб Ливинг"
14,"доска Polarwood Ясень Ливинг","Polarwood Ясень Ливинг"
15,"доска Polarwood Дуб Коттедж","Polarwood Дуб Коттедж"
16,"доска Polarwood Дуб Венера","Polarwood Дуб Венера"
19,"доска Upofloor Ясень Кантри Marble Matt МЛБ 3-полосный 3,41м2/уп.","Upofloor Ясень Кантри Marble Matt МЛБ 3-полосный 3,41м2/уп."
21,"доска Upofloor Дуб Classic Brown СЛ 3,41 м2/уп 3-полосный","Upofloor Дуб Classic Brown СЛ 3,41 м2/уп 3-полосный"
22,"доска Upofloor Дуб Silver СЛ 3-полосный 3,41м2/уп","Upofloor Дуб Silver СЛ 3-полосный 3,41м2/уп"
23,"доска Amber Wood Ясень Миндаль","Amber Wood Ясень Миндаль"
24,"доска Amber Wood Ясень Бурбон","Amber Wood Ясень Бурбон"
25,"доска Amber Wood Ясень Махагон","Amber Wood Ясень Махагон"
26,"доска Amber Wood Ясень Шампань","Amber Wood Ясень Шампань"
27,"доска Amber Wood Ясень Слоновая кость","Amber Wood Ясень Слоновая кость"
28,"доска Baum Дуб Карамель","Baum Дуб Карамель"
29,"доска Baum Дуб Кофе","Baum Дуб Кофе"
30,"доска Baum Дуб Селект","Baum Дуб Селект"
31,"доска Baum Ясень Барокко","Baum Ясень Барокко"
32,"доска Baum Ясень Сахара","Baum Ясень Сахара"
33,"доска Esta Parket Ясень Antique","Esta Parket Ясень Antique"
34,"доска Esta Parket Дуб Village(natur)","Esta Parket Дуб Village(natur)"
35,"доска Esta Parket Ясень Brendy","Esta Parket Ясень Brendy"
36,"доска Esta Parket Ясень Honey","Esta Parket Ясень Honey"
37,"доска Esta Parket Ясень Rose","Esta Parket Ясень Rose"
38,"доска FocusFloor Дуб Либецио (LIBECCIO)","FocusFloor Дуб Либецио (LIBECCIO)"
39,"доска FocusFloor Дуб Хамсин (KHAMSIN)","FocusFloor Дуб Хамсин (KHAMSIN)"
40,"доска FocusFloor Дуб Лодос (LODOS)","FocusFloor Дуб Лодос (LODOS)"
41,"доска FocusFloor Дуб Сирокко (SIROCCO)","FocusFloor Дуб Сирокко (SIROCCO)"
42,"доска FocusFloor Ясень Мистраль (MISTRAL)","FocusFloor Ясень Мистраль (MISTRAL)"
43,"доска Barlinek Дуб Berlin","Barlinek Дуб Berlin"
44,"доска Barlinek Ясень Munchen","Barlinek Ясень Munchen"
45,"доска Barlinek Дуб Goldberg","Barlinek Дуб Goldberg"
46,"доска Barlinek Ясень Frankfurt","Barlinek Ясень Frankfurt"
47,"доска Barlinek Ясень Saimaa","Barlinek Ясень Saimaa"
48,"доска Karelia Дуб Natural","Karelia Дуб Natural"
49,"доска Karelia Ясень Country Vanilla Matt","Karelia Ясень Country Vanilla Matt"
50,"доска Karelia Дуб Rock Salt","Karelia Дуб Rock Salt"
51,"доска Karelia Дуб Oregano","Karelia Дуб Oregano"
52,"доска Karelia Дуб Darc Chocolate","Karelia Дуб Darc Chocolate"
53,"доска Ellett Ясень Super White","Ellett Ясень Super White"
54,"доска Ellett Дуб Grey","Ellett Дуб Grey"
55,"доска Ellett Ясень Select Super White","Ellett Ясень Select Super White"
56,"доска Ellett Вяз Elm Red","Ellett Вяз Elm Red"
57,"доска Ellett Вяз Elm Red","Ellett Вяз Elm Red"
58,"доска Wood Bee Дуб Антик Блэк Стори","Wood Bee Дуб Антик Блэк Стори"
59,"доска Wood Bee Бамбук Кофе","Wood Bee Бамбук Кофе"
60,"доска Wood Bee Бамбук Натур","Wood Bee Бамбук Натур"
61,"доска Wood Bee Дуб Вулканик","Wood Bee Дуб Вулканик"
62,"доска Wood Bee Дуб натур Браш","Wood Bee Дуб натур Браш"
63,"доска Boen-Hohns Дуб Cottage","Boen-Hohns Дуб Cottage"
64,"доска Boen-Hohns Ясень Palace","Boen-Hohns Ясень Palace"
65,"доска Boen-Hohns Дуб Ganstock","Boen-Hohns Дуб Ganstock"
66,"доска Boen-Hohns Дуб Cocoa","Boen-Hohns Дуб Cocoa"
67,"доска Boen-Hohns Дуб Metropole","Boen-Hohns Дуб Metropole"
68,"доска Coswick Дуб Французский гобелен / French Gobelin","Coswick Дуб Французский гобелен / French Gobelin"
69,"доска Coswick Дуб Ванильный","Coswick Дуб Ванильный"
70,"доска Coswick Дуб Антик белый (Antique white)","Coswick Дуб Антик белый (Antique white)"
71,"доска Coswick Ясень Аваланж (Avalanche)","Coswick Ясень Аваланж (Avalanche)"
72,"доска Coswick Дуб Орех","Coswick Дуб Орех"
73,"доска Kahrs Дуб Прилив натуральное масло браш (Лодж)","Kahrs Дуб Прилив натуральное масло браш (Лодж)"
74,"доска Kahrs Дуб Прилив матовый лак (Лодж)","Kahrs Дуб Прилив матовый лак (Лодж)"
75,"доска Kahrs Дуб Бриз сатиновый лак (Лодж)","Kahrs Дуб Бриз сатиновый лак (Лодж)"
76,"доска Kahrs Дуб Бриз матовый лак (Лодж)","Kahrs Дуб Бриз матовый лак (Лодж)"
77,"доска Kahrs Орех Дождь (Лодж)","Kahrs Орех Дождь (Лодж)"
79,"доска Universal Гевея Прайм красная","Universal Гевея Прайм красная"
80,"доска Universal Дуб Прайм","Universal Дуб Прайм"
81,"доска Universal Дуб Прайм Мраморный","Universal Дуб Прайм Мраморный"
82,"доска Universal Дуб прайм термо","Universal Дуб прайм термо"
83,"доска Timberwise Дуб Alaska масло","Timberwise Дуб Alaska масло"
84,"доска Timberwise Дуб Adriatic масло","Timberwise Дуб Adriatic масло"
85,"доска Timberwise Дуб Bering","Timberwise Дуб Bering"
86,"доска Timberwise Дуб Carbon White","Timberwise Дуб Carbon White"
87,"доска Timberwise Дуб Choco 50%","Timberwise Дуб Choco 50%"
88,"доска Old Wood Дуб Шоколад рустик","Old Wood Дуб Шоколад рустик"
89,"доска Old Wood Дуб Натуральный","Old Wood Дуб Натуральный"
90,"доска Old Wood Ясень Крем белый","Old Wood Ясень Крем белый"
91,"доска Old Wood Ясень Шоколад ТЕРМО","Old Wood Ясень Шоколад ТЕРМО"
92,"доска Old Wood Дуб Карамель","Old Wood Дуб Карамель"
93,"доска Grabo Дуб Примо","Grabo Дуб Примо"
94,"доска Grabo Ясень Тренд","Grabo Ясень Тренд"
95,"доска Grabo Дуб Натур","Grabo Дуб Натур"
96,"доска Grabo Дуб Рустик","Grabo Дуб Рустик"
97,"доска Grabo Ясень Тренд белый лак","Grabo Ясень Тренд белый лак"
98,"доска Par-Ky Дуб европейский brushed PB101","Par-Ky Дуб европейский brushed PB101"
99,"доска Par-Ky Дуб Ivory brushed PB102","Par-Ky Дуб Ivory brushed PB102"
100,"доска Par-Ky Дуб Milk brushed PB103","Par-Ky Дуб Milk brushed PB103"
101,"доска Par-Ky Дуб Desert brushed  PB104","Par-Ky Дуб Desert brushed  PB104"
102,"доска Par-Ky Дуб Mystery brushed PB105","Par-Ky Дуб Mystery brushed PB105"
103,"доска Panaget Французский Дуб Гранит","Panaget Французский Дуб Гранит"
104,"доска Panaget Орех американский","Panaget Орех американский"
105,"доска Panaget Французский дуб Топия","Panaget Французский дуб Топия"
106,"доска Panaget Французский дуб Салина","Panaget Французский дуб Салина"
107,"доска Panaget Французский дуб Слива","Panaget Французский дуб Слива"
108,"доска Weitzer Дуб Миндаль","Weitzer Дуб Миндаль"
109,"доска Weitzer Дуб Гавана","Weitzer Дуб Гавана"
110,"доска Weitzer Дуб Трюфель","Weitzer Дуб Трюфель"
111,"доска Weitzer Дуб Кашемир","Weitzer Дуб Кашемир"
112,"доска Weitzer Дуб Айс","Weitzer Дуб Айс"
114,"доска Mazarri Дуб арт.77-02","Mazarri Дуб арт.77-02"
115,"доска Mazarri Дуб арт.77-04","Mazarri Дуб арт.77-04"
116,"доска Mazarri Дуб арт.77-05","Mazarri Дуб арт.77-05"
117,"доска Mazarri Дуб арт.77-06","Mazarri Дуб арт.77-06"
118,"доска Siberian Floor Дуб Априкот, лак УФ","Siberian Floor Дуб Априкот, лак УФ"
119,"доска Siberian Floor Дуб Эбенхольц, масло УФ","Siberian Floor Дуб Эбенхольц, масло УФ"
120,"доска Siberian Floor Дуб Белый, масло УФ","Siberian Floor Дуб Белый, масло УФ"
121,"доска Siberian Floor Дуб Антик, масло УФ","Siberian Floor Дуб Антик, масло УФ"
122,"доска Siberian Floor Дуб Платина, лак УФ","Siberian Floor Дуб Платина, лак УФ"
123,"доска Greenline Дуб Леон","Greenline Дуб Леон"
124,"доска Greenline Дуб Майорка","Greenline Дуб Майорка"
125,"доска Greenline Дуб Севилья","Greenline Дуб Севилья"
126,"доска Greenline Дуб Верона","Greenline Дуб Верона"
127,"доска Greenline Дуб Венеция","Greenline Дуб Венеция"
128,"доска Global Parquet Дуб Plum (Слива)","Global Parquet Дуб Plum (Слива)"
129,"доска Global Parquet Дуб Cream Currant (Смородина)","Global Parquet Дуб Cream Currant (Смородина)"
130,"доска Global Parquet Дуб Pine Nut (Кедровый)","Global Parquet Дуб Pine Nut (Кедровый)"
131,"доска Global Parquet Дуб Peach (Персик)","Global Parquet Дуб Peach (Персик)"
132,"доска Global Parquet Дуб Raisins (Изюм)","Global Parquet Дуб Raisins (Изюм)"
133,"доска Bauwerk Дуб Duna","Bauwerk Дуб Duna"
134,"доска Bauwerk Дуб Sasso","Bauwerk Дуб Sasso"
135,"доска Bauwerk Дуб Farina","Bauwerk Дуб Farina"
136,"доска Bauwerk Дуб","Bauwerk Дуб"
137,"доска Bauwerk Дуб копчёный","Bauwerk Дуб копчёный"
138,"доска Mercier Канадский Твердый Клен Арабика","Mercier Канадский Твердый Клен Арабика"
139,"доска Mercier Канадский Твердый Клен Шоколадный","Mercier Канадский Твердый Клен Шоколадный"
140,"доска Mercier Канадский Твердый Клен Затмение","Mercier Канадский Твердый Клен Затмение"
141,"доска Mercier Канадский Твердый Клен Каменно-Коричневый","Mercier Канадский Твердый Клен Каменно-Коричневый"
142,"доска Mercier Канадский Твердый Клен Корица","Mercier Канадский Твердый Клен Корица"
143,"доска Missouri Collection Орех Американский натур(16х140)","Missouri Collection Орех Американский натур(16х140)"
144,"доска Missouri Collection Орех Американский натур(16х190)","Missouri Collection Орех Американский натур(16х190)"
145,"доска Missouri Collection Орех Американский селект(16х140)","Missouri Collection Орех Американский селект(16х140)"
146,"доска Missouri Collection Орех Американский селект(16х190)","Missouri Collection Орех Американский селект(16х190)"
147,"доска Coswick Дуб  Антик белый / Antique white Кантри","Coswick Дуб  Антик белый / Antique white Кантри"
148,"доска Coswick Дуб Терракота / Terracotta Кантри","Coswick Дуб Терракота / Terracotta Кантри"
149,"доска Coswick Дуб  Френч Эстейт / French Estate Кантри","Coswick Дуб  Френч Эстейт / French Estate Кантри"
150,"доска Coswick Дуб Тёмный Шоколад / Dark chocolate","Coswick Дуб Тёмный Шоколад / Dark chocolate"
151,"доска Coswick Дуб Бразильский орех / Walnut Кантри","Coswick Дуб Бразильский орех / Walnut Кантри"
152,"доска Boen-Hohns Дуб Traditional","Boen-Hohns Дуб Traditional"
153,"доска Boen-Hohns Дуб Traditional белый","Boen-Hohns Дуб Traditional белый"
154,"доска Boen-Hohns Дуб Pearl","Boen-Hohns Дуб Pearl"
155,"доска Boen-Hohns Дуб Antique","Boen-Hohns Дуб Antique"
156,"доска Boen-Hohns Дуб Stonewashed Old grey","Boen-Hohns Дуб Stonewashed Old grey"
162,"доска Progress Сахара","Progress Сахара"
163,"доска Progress Британия","Progress Британия"
164,"доска Progress Церматт","Progress Церматт"
165,"доска Progress Дюфур (ясень)","Progress Дюфур (ясень)"
166,"доска Progress Эльм","Progress Эльм"
167,"доска Mazarri Верона темный","Mazarri Верона темный"
168,"доска Mazarri Гордон темный","Mazarri Гордон темный"
169,"доска Mazarri Верона Эстато","Mazarri Верона Эстато"
170,"доска Mazarri Верона светлый","Mazarri Верона светлый"
171,"доска Mazarri Верона Пулито","Mazarri Верона Пулито"
172,"доска Bolefloor Дуб без покрытия","Bolefloor Дуб без покрытия"
173,"доска Bolefloor Дуб","Bolefloor Дуб"
174,"доска Bolefloor Дуб","Bolefloor Дуб"
176,"доска Doms Lack","Doms Lack"
175,"доска Bolefloor Дуб","Bolefloor Дуб"
177,"доска Doms Grey","Doms Grey"
178,"доска Doms Vagnila","Doms Vagnila"
179,"доска Doms Noce","Doms Noce"
180,"доска Doms Nougat","Doms Nougat"
181,"доска Wood Bee Дуб Натур Браш","Wood Bee Дуб Натур Браш"
182,"доска Wood Bee Дуб Коньяк","Wood Bee Дуб Коньяк"
183,"доска Wood Bee Ясень Коньяк","Wood Bee Ясень Коньяк"
184,"доска Wood Bee Дуб Селект","Wood Bee Дуб Селект"
185,"доска Wood Bee Дуб Вайт","Wood Bee Дуб Вайт"
191,"доска Tavolini Floors Дуб Натуральный","Tavolini Floors Дуб Натуральный"
186,"елка Louvre Орех Американский","Louvre Орех Американский"
193,"доска Tavolini Floors Дуб Siena","Tavolini Floors Дуб Siena"
194,"доска Tavolini Floors Дуб Elba","Tavolini Floors Дуб Elba"
195,"доска Tavolini Floors Дуб Lido","Tavolini Floors Дуб Lido"
197,"доска Mazarri Дуб Натуральный","Mazarri Дуб Натуральный"
196,"доска  Дуб Натур","Дуб Натур"
198,"доска Mazarri Дуб Ноче Олд","Mazarri Дуб Ноче Олд"
199,"доска Mazarri Дуб Марроне","Mazarri Дуб Марроне"
200,"доска Mazarri Дуб Морденте","Mazarri Дуб Морденте"
201,"доска Greenline Дуб Милан","Greenline Дуб Милан"
202,"доска Greenline Дуб Мурано","Greenline Дуб Мурано"
203,"доска Greenline Дуб Флоренция","Greenline Дуб Флоренция"
204,"доска Greenline Дуб Тоскано","Greenline Дуб Тоскано"
205,"доска Greenline Дуб Кьянти","Greenline Дуб Кьянти"
206,"доска Mazarri Дуб Термо","Mazarri Дуб Термо"
212,"доска  Дуб натуральный сортировка Рустик","Дуб натуральный сортировка Рустик"
214,"доска  Дуб натуральный сортировка Натур","Дуб натуральный сортировка Натур"
216,"доска Coswick Дуб Молочный шоколад","Coswick Дуб Молочный шоколад"
217,"доска Coswick Ясень Мокка / Mocca","Coswick Ясень Мокка / Mocca"
218,"доска Coswick Дуб Янтарный / Amber","Coswick Дуб Янтарный / Amber"
219,"доска Coswick Дуб Натуральный / Natural, коммон","Coswick Дуб Натуральный / Natural, коммон"
220,"доска Coswick Дуб Мускат / Muscat","Coswick Дуб Мускат / Muscat"
221,"доска Boen-Hohns Дуб Traditional","Boen-Hohns Дуб Traditional"
222,"доска Boen-Hohns Дуб Traditional белый","Boen-Hohns Дуб Traditional белый"
223,"доска Boen-Hohns Дуб Stonewashed Old grey","Boen-Hohns Дуб Stonewashed Old grey"
224,"доска Boen-Hohns Дуб Antique","Boen-Hohns Дуб Antique"
225,"доска Boen-Hohns Дуб Highland","Boen-Hohns Дуб Highland"
226,"доска Progress Сахара","Progress Сахара"
227,"доска Progress Британия","Progress Британия"
228,"доска Progress Церматт","Progress Церматт"
229,"доска Progress Дюфур (ясень)","Progress Дюфур (ясень)"
230,"доска Progress Эльм","Progress Эльм"
232,"доска  Палисандр Селект","Палисандр Селект"
233,"доска  Мербау L","Мербау L"
234,"доска  Мербау M","Мербау M"
235,"доска  Мербау D","Мербау D"
236,"доска Mercier Дуб Красный медовый","Mercier Дуб Красный медовый"
237,"доска Mercier Канадский Твердый Клен темно-коричневый","Mercier Канадский Твердый Клен темно-коричневый"
238,"доска Mercier Дуб Красный  Умеренно-коричневый","Mercier Дуб Красный  Умеренно-коричневый"
239,"доска Mercier Дуб Красный Графит Эритаж","Mercier Дуб Красный Графит Эритаж"
240,"доска Mercier Дуб Красный Шоколад Эритаж","Mercier Дуб Красный Шоколад Эритаж"
241,"доска Amigo Бамбук Кофе горизонтальный","Amigo Бамбук Кофе горизонтальный"
242,"доска Amigo Дуб Натур","Amigo Дуб Натур"
243,"доска Amigo Дуб Табако","Amigo Дуб Табако"
244,"доска Amigo Дуб Лазурный берег","Amigo Дуб Лазурный берег"
245,"доска Amigo Дуб Карамель","Amigo Дуб Карамель"
246,"доска Komodoor Мербау","Komodoor Мербау"
247,"доска Komodoor Кемпас","Komodoor Кемпас"
248,"доска Komodoor Мербау клееный массив","Komodoor Мербау клееный массив"
249,"доска Komodoor Кемпас Клееный массив","Komodoor Кемпас Клееный массив"
250,"доска Komodoor Ормозия","Komodoor Ормозия"
251,"доска Jackson Flooring Натур","Jackson Flooring Натур"
252,"доска Jackson Flooring Кофе","Jackson Flooring Кофе"
253,"доска Jackson Flooring Черное золото","Jackson Flooring Черное золото"
254,"доска Jackson Flooring Темный ром","Jackson Flooring Темный ром"
255,"доска Jackson Flooring Каменная волна","Jackson Flooring Каменная волна"
256,"доска Ribadao Ироко","Ribadao Ироко"
257,"доска Ribadao Тигровое дерево","Ribadao Тигровое дерево"
258,"доска Ribadao Ятоба","Ribadao Ятоба"
259,"доска Ribadao Боссе","Ribadao Боссе"
260,"доска Ribadao Сукупира","Ribadao Сукупира"
261,"доска Missouri Collection Кумару","Missouri Collection Кумару"
262,"доска Missouri Collection Сукупира","Missouri Collection Сукупира"
263,"доска Missouri Collection Палисандр","Missouri Collection Палисандр"
264,"доска Missouri Collection Caffe. Дуб американский с карбонизированной обработкой","Missouri Collection Caffe. Дуб американский с карбонизированной обработкой"
265,"доска Missouri Collection Clou. Дуб американский с карбонизированной обработкой","Missouri Collection Clou. Дуб американский с карбонизированной обработкой"
266,"доска Inpa Ибираро (Парагвайский орех)","Inpa Ибираро (Парагвайский орех)"
268,"доска Inpa Лапачо (Ипе)","Inpa Лапачо (Ипе)"
269,"доска Inpa Курупау (Патагонский палисандр)","Inpa Курупау (Патагонский палисандр)"
270,"доска Inpa Сото (Парагвайский палисандр)","Inpa Сото (Парагвайский палисандр)"
267,"доска Inpa Ятоба (Бразильская вишня)","Inpa Ятоба (Бразильская вишня)"
271,"доска Magestik Floor Бамбук Натур","Magestik Floor Бамбук Натур"
272,"доска Magestik Floor Бамбук Кофе","Magestik Floor Бамбук Кофе"
273,"доска Magestik Floor Кемпас","Magestik Floor Кемпас"
274,"доска Magestik Floor Каслин Орех","Magestik Floor Каслин Орех"
275,"доска Magestik Floor Береза Черная","Magestik Floor Береза Черная"
276,"доска Amber Wood Дуб Белый 18х120х300-1800","Amber Wood Дуб Белый 18х120х300-1800"
277,"доска Amber Wood Ясень Белый","Amber Wood Ясень Белый"
278,"доска Amber Wood Ясень Светлый орех","Amber Wood Ясень Светлый орех"
279,"доска Amber Wood Ясень кофе 18х120х300-1800","Amber Wood Ясень кофе 18х120х300-1800"
280,"доска Amber Wood Ясень Шоколад","Amber Wood Ясень Шоколад"
282,"доска Sherwood Клен европейский","Sherwood Клен европейский"
283,"доска Sherwood Ятоба","Sherwood Ятоба"
284,"доска Sherwood Грецкий орех","Sherwood Грецкий орех"
286,"доска Bolefloor дуб рустик","Bolefloor дуб рустик"
287,"доска Bolefloor клен","Bolefloor клен"
288,"доска Bolefloor ясень натур","Bolefloor ясень натур"
289,"доска Bolefloor дуб натур","Bolefloor дуб натур"
290,"доска Bolefloor ясень селект","Bolefloor ясень селект"
291,"доска Tavolini Floors Дуб Натуральный","Tavolini Floors Дуб Натуральный"
292,"доска Tavolini Floors Дуб Etna","Tavolini Floors Дуб Etna"
293,"доска Tavolini Floors Дуб Monaco","Tavolini Floors Дуб Monaco"
294,"доска Tavolini Floors Дуб Dante","Tavolini Floors Дуб Dante"
295,"доска Tavolini Floors Дуб Bruno","Tavolini Floors Дуб Bruno"
298,"доска Berthold Дуб европейский маркант","Berthold Дуб европейский маркант"
300,"доска Berthold Ясень европейский маркант","Berthold Ясень европейский маркант"
301,"паркет Siberian Floor Дуб морёный, Нордик, масло OSMO МОДУЛЬ № 3","Siberian Floor Дуб морёный, Нордик, масло OSMO МОДУЛЬ № 3"
302,"паркет Siberian Floor Дуб Бурбон, лак УФ Белая патина МОДУЛЬ № 7","Siberian Floor Дуб Бурбон, лак УФ Белая патина МОДУЛЬ № 7"
303,"паркет Siberian Floor Дуб Бурбон, масло Черное УФ МОДУЛЬ № 7","Siberian Floor Дуб Бурбон, масло Черное УФ МОДУЛЬ № 7"
304,"паркет Siberian Floor Дуб лак УФ МОДУЛЬ № 13","Siberian Floor Дуб лак УФ МОДУЛЬ № 13"
305,"паркет Siberian Floor Дуб лак УФ МОДУЛЬ № 12","Siberian Floor Дуб лак УФ МОДУЛЬ № 12"
306,"паркет Coswick Blois (Блуа) - ясень","Coswick Blois (Блуа) - ясень"
307,"паркет Coswick Blois (Блуа) - дуб","Coswick Blois (Блуа) - дуб"
