4197,"Паркет -  Дуб Натур  20* 170*500-2000 мм","-  Дуб Натур  20* 170*500-2000 мм"
4179,"-  Дуб Plank Abisko","Дуб Plank Abisko"
4198,"Паркет -  Дуб Классик 20* 120*500-2000 мм","-  Дуб Классик 20* 120*500-2000 мм"
4200,"Паркет -  Дуб Классик 20* 170*500-2000 мм","-  Дуб Классик 20* 170*500-2000 мм"
4143,"-  Дуссие",Дуссие
4142,"-  Мербау",Мербау
4201,"Паркет -  Дуб Рустик  20* 120*500-2000 мм","-  Дуб Рустик  20* 120*500-2000 мм"
4199,"Паркет -  Дуб Классик 20* 130-150*500-2000 мм","-  Дуб Классик 20* 130-150*500-2000 мм"
4202,"Паркет -  Дуб Рустик 20* 130-150*500-2000 мм","-  Дуб Рустик 20* 130-150*500-2000 мм"
4203,"Паркет -  Дуб Рустик 20* 170*500-2000 мм","-  Дуб Рустик 20* 170*500-2000 мм"
4206,"Паркет -  Дуб рустик","-  Дуб рустик"
4204,"Паркет -  Дуб селект","-  Дуб селект"
4205,"Паркет -  Дуб натур","-  Дуб натур"
4209,"Паркет -  Ясень рустик","-  Ясень рустик"
4208,"Паркет -  Ясень натур","-  Ясень натур"
4207,"Паркет -  Ясень селект","-  Ясень селект"
4210,"Паркет -  Ясень селект","-  Ясень селект"
4211,"Паркет -  Дуб Натур Отборн. 20* 120*500-2000 мм","-  Дуб Натур Отборн. 20* 120*500-2000 мм"
4212,"Паркет -  Дуб Натур Отборн. 20* 130-150*500-2000 мм","-  Дуб Натур Отборн. 20* 130-150*500-2000 мм"
4213,"Паркет -  Дуб Натур Отборн. 20* 170*500-2000 мм","-  Дуб Натур Отборн. 20* 170*500-2000 мм"
4214,"Паркет -  Дуб Натур  20* 120*500-2000 мм","-  Дуб Натур  20* 120*500-2000 мм"
4223,"мастер -  Мербау селект M 420?70?15мм","-  Мербау селект M 420?70?15мм"
4215,"Паркет -  Дуб Натур  20* 130-150*500-2000 мм","-  Дуб Натур  20* 130-150*500-2000 мм"
4224,"мастер -  Мербау селект D 420?70?15мм","-  Мербау селект D 420?70?15мм"
4238,Стори,Стори
4236,"Натур антик",антик
4240,Арктик,Арктик
4241,Серый,Серый
4242,Черно-белый,Черно-белый
4243,"Коричневый состаренный",состаренный
4244,Селект,Селект
4245,"Белая ночь",ночь
4246,Карамель,Карамель
4271,"доска Marco Ferutti Linea - Тик бирманский браш","Marco Ferutti Linea - Тик бирманский браш"
4249,Неаполь,Неаполь
4247,Мокко,Мокко
4272,"доска Marco Ferutti Versailles - Тик бирманский","Marco Ferutti Versailles - Тик бирманский"
4273,"доска Global Parquet Бирманский тик","Global Parquet Бирманский тик"
4278,"доска Mazarri Орех Американский 15х127 Селект","Mazarri Орех Американский 15х127 Селект"
4277,"доска Mazarri Орех Американский 15х127 Натур","Mazarri Орех Американский 15х127 Натур"
4279,"доска Mazarri Орех Американский 15х130 Селект","Mazarri Орех Американский 15х130 Селект"
4281,"доска Mazarri Орех Американский 15х160 Селект","Mazarri Орех Американский 15х160 Селект"
4280,"доска Mazarri Орех Американский 15х90 Селект","Mazarri Орех Американский 15х90 Селект"
4284,"доска Mazarri Дуб Крема ди Маре","Mazarri Дуб Крема ди Маре"
4282,"доска Mazarri Дуб арт.5509","Mazarri Дуб арт.5509"
4283,"доска Siberian Floor Дуб Серый №5, патина серая, лак УФ","Siberian Floor Дуб Серый №5, патина серая, лак УФ"
4285,"доска Mazarri Дуб Иней с серебрянной патиной","Mazarri Дуб Иней с серебрянной патиной"
4286,"доска Barlinek Дуб Panna Cotta Трехполосная","Barlinek Дуб Panna Cotta Трехполосная"
4290,"доска Marco Ferutti Castello - Дуб Арктик","Marco Ferutti Castello - Дуб Арктик"
4287,"паркет Siberian Floor Дуб Тюдор, осветлённый, масло Серое OSMO МОДУЛЬ № 9","Siberian Floor Дуб Тюдор, осветлённый, масло Серое OSMO МОДУЛЬ № 9"
4288,"доска Marco Ferutti Linea - Дуб Нордик","Marco Ferutti Linea - Дуб Нордик"
4291,"доска Marco Ferutti Versailles - Дуб Нордик","Marco Ferutti Versailles - Дуб Нордик"
4289,"доска Marco Ferutti Linea - Дуб Ванила","Marco Ferutti Linea - Дуб Ванила"
4292,"доска Bauwerk Дуб Deserto","Bauwerk Дуб Deserto"
4294,"доска Bauwerk Дуссия","Bauwerk Дуссия"
4293,"доска Bauwerk Дуб Tobacco","Bauwerk Дуб Tobacco"
4296,"доска Bauwerk White","Bauwerk White"
4295,"доска Bauwerk Сукупира","Bauwerk Сукупира"
4299,"доска Bauwerk Сукупира","Bauwerk Сукупира"
4297,"доска Bauwerk Yellow light","Bauwerk Yellow light"
4298,"доска Bauwerk  Yellow intense","Bauwerk  Yellow intense"
4301,"доска Bauwerk Американский орех","Bauwerk Американский орех"
4300,"доска Bauwerk Американская вишня","Bauwerk Американская вишня"
4302,"доска Bauwerk Акация пропаренная","Bauwerk Акация пропаренная"
4303,"доска Bauwerk Blue light","Bauwerk Blue light"
4306,"доска Bauwerk Red intese","Bauwerk Red intese"
4305,"доска Bauwerk  Red light","Bauwerk  Red light"
4304,"доска Bauwerk Blue intense","Bauwerk Blue intense"
4309,"доска Bauwerk Mandala","Bauwerk Mandala"
4308,"доска Bauwerk Green intense","Bauwerk Green intense"
4307,"доска Bauwerk Green light","Bauwerk Green light"
4312,"доска Esta Parket Ясень Silver Moon","Esta Parket Ясень Silver Moon"
4311,"доска Upofloor Дуб Натур СЛ 1- полосный 3,41м2/уп","Upofloor Дуб Натур СЛ 1- полосный 3,41м2/уп"
4314,"доска Mercier Белый Ясень Портобелло","Mercier Белый Ясень Портобелло"
4313,"доска Coswick Ясень Комо / Como Авторская","Coswick Ясень Комо / Como Авторская"
4315,"доска Mercier Белый Ясень Выбеленный","Mercier Белый Ясень Выбеленный"
4320,"доска Mazarri Ясень Ванильный","Mazarri Ясень Ванильный"
4323,"доска Upofloor Дуб Nature Marble 14мм МЛБ 2,0/2,2м2/уп","Upofloor Дуб Nature Marble 14мм МЛБ 2,0/2,2м2/уп"
4324,"доска Upofloor Дуб Латте НМБ/Б 2,0/2,2м2/уп. 1-полосный","Upofloor Дуб Латте НМБ/Б 2,0/2,2м2/уп. 1-полосный"
4325,"доска Upofloor Дуб Grand Latte 14мм НМБ/Б/Ф 2,0/2,2м2/уп","Upofloor Дуб Grand Latte 14мм НМБ/Б/Ф 2,0/2,2м2/уп"
4326,"доска Upofloor Дуб Grand Brushed White Olied 14мм НМБ/Б/Ф 2,2м2/уп","Upofloor Дуб Grand Brushed White Olied 14мм НМБ/Б/Ф 2,2м2/уп"
4327,"доска Upofloor Дуб Nature Marble 14мм МЛБ 3,41 м2/уп","Upofloor Дуб Nature Marble 14мм МЛБ 3,41 м2/уп"
4328,"доска Upofloor Дуб Nature Marble 14мм МЛБ 3.0 м2/уп","Upofloor Дуб Nature Marble 14мм МЛБ 3.0 м2/уп"
4329,"доска Upofloor Дуб Grand Basalt СЛ/Ф","Upofloor Дуб Grand Basalt СЛ/Ф"
4330,"доска Upofloor Дуб Thunder Cloud НМБ/Б","Upofloor Дуб Thunder Cloud НМБ/Б"
4332,"доска Upofloor Дуб Grand White Marble СЛ/Ф","Upofloor Дуб Grand White Marble СЛ/Ф"
4331,"доска Upofloor Дуб Silver Mist НМЦ/Б","Upofloor Дуб Silver Mist НМЦ/Б"
4333,"доска Upofloor Дуб Grand Fog Shadow МЛБ/Б/Ф","Upofloor Дуб Grand Fog Shadow МЛБ/Б/Ф"
4334,"доска Upofloor Дуб Frost НМЦ/Б","Upofloor Дуб Frost НМЦ/Б"
4338,"доска Baum Дуб Термо","Baum Дуб Термо"
4335,"доска Upofloor Дуб Венге СЛ 2,0/2,2м2/уп 1-полосный","Upofloor Дуб Венге СЛ 2,0/2,2м2/уп 1-полосный"
4336,"доска Upofloor Дуб Классик Браун СЛ 2,0/2,2м2/уп. 1-полосный","Upofloor Дуб Классик Браун СЛ 2,0/2,2м2/уп. 1-полосный"
4337,"доска Upofloor Дуб  Натур Антик МЛ 2,0/2,2м2/уп 1-полосный","Upofloor Дуб  Натур Антик МЛ 2,0/2,2м2/уп 1-полосный"
4339,"доска Baum Ясень Термо","Baum Ясень Термо"
4340,"доска Baum Дуб Селект","Baum Дуб Селект"
4342,"доска Baum Дуб Дымчатый","Baum Дуб Дымчатый"
4341,"доска Baum Дуб Кофе","Baum Дуб Кофе"
4343,"доска Baum Ясень Арктик","Baum Ясень Арктик"
4344,"доска Baum Дуб Табачный","Baum Дуб Табачный"
4345,"доска Baum Дуб Белёный","Baum Дуб Белёный"
4347,"доска Baum Дуб Розовый жемчуг","Baum Дуб Розовый жемчуг"
4348,"доска Baum Ясень Сахара","Baum Ясень Сахара"
4349,"доска Baum Дуб Коттедж","Baum Дуб Коттедж"
4350,"доска Baum Дуб Мореный","Baum Дуб Мореный"
4351,"доска Baum Дуб Серебро","Baum Дуб Серебро"
4353,"доска Barlinek Дуб Almond Piccolo","Barlinek Дуб Almond Piccolo"
4352,"доска Baum Дуб Копченый белый","Baum Дуб Копченый белый"
4354,"доска Barlinek Дуб Peach Piccolo","Barlinek Дуб Peach Piccolo"
4355,"доска Barlinek Дуб Espresso Piccolo","Barlinek Дуб Espresso Piccolo"
4358,"доска Barlinek Ясень Moonlight Piccolo","Barlinek Ясень Moonlight Piccolo"
4357,"доска Barlinek Дуб Apricot Sorbet Piccolo","Barlinek Дуб Apricot Sorbet Piccolo"
4356,"доска Barlinek Дуб Coconut Piccolo","Barlinek Дуб Coconut Piccolo"
4359,"доска Barlinek Дуб Snowflakes Piccolo","Barlinek Дуб Snowflakes Piccolo"
4360,"доска Barlinek Дуб Brown Sugar Piccolo","Barlinek Дуб Brown Sugar Piccolo"
4364,"доска Barlinek Ясень Hazelnut","Barlinek Ясень Hazelnut"
4361,"доска Barlinek Ясень Coffee","Barlinek Ясень Coffee"
4362,"доска Barlinek Дуб Ascania","Barlinek Дуб Ascania"
4365,"доска Barlinek Ясень Lime Sorbet","Barlinek Ясень Lime Sorbet"
4366,"доска Barlinek Дуб White Truffle","Barlinek Дуб White Truffle"
4369,"доска Barlinek Дуб Calvados","Barlinek Дуб Calvados"
4367,"доска Barlinek Дуб Porto","Barlinek Дуб Porto"
4368,"доска Barlinek Дуб Ivory","Barlinek Дуб Ivory"
4371,"доска Barlinek Дуб Cheesecake Трехполосная","Barlinek Дуб Cheesecake Трехполосная"
4370,"доска Barlinek Дуб Almond","Barlinek Дуб Almond"
4372,"доска Barlinek Ясень Milk Shake","Barlinek Ясень Milk Shake"
4373,"доска Barlinek Дуб Olive Crostini","Barlinek Дуб Olive Crostini"
4374,"доска Barlinek Дуб Balsamico","Barlinek Дуб Balsamico"
4375,"доска Barlinek Дуб Affogato","Barlinek Дуб Affogato"
4376,"доска Barlinek Дуб Panna Cotta Однополоснная","Barlinek Дуб Panna Cotta Однополоснная"
4377,"доска Barlinek Дуб Cheesecake Однополосная","Barlinek Дуб Cheesecake Однополосная"
4380,"доска Barlinek Дуб Banana Song","Barlinek Дуб Banana Song"
4378,"доска Barlinek Дуб Marzipan Muffin","Barlinek Дуб Marzipan Muffin"
4379,"доска Barlinek Дуб Cappuccino","Barlinek Дуб Cappuccino"
4381,"доска Barlinek Дуб Biscuits","Barlinek Дуб Biscuits"
4382,"доска Barlinek Дуб Toffee","Barlinek Дуб Toffee"
4383,"доска Karelia Дуб Stonewashed Legend Revival","Karelia Дуб Stonewashed Legend Revival"
4384,"доска Karelia Дуб Stonewashed Legend Presence","Karelia Дуб Stonewashed Legend Presence"
4385,"доска Karelia Дуб Stonewashed Legend Vision","Karelia Дуб Stonewashed Legend Vision"
4386,"доска Karelia Дуб Natur Vanilla Matt 188","Karelia Дуб Natur Vanilla Matt 188"
4387,"доска Karelia Дуб Ivory Stonewashed 138","Karelia Дуб Ivory Stonewashed 138"
4388,"доска Karelia Дуб Natur Vanilla Matt 138","Karelia Дуб Natur Vanilla Matt 138"
4389,"доска Karelia Дуб Natur New Arctic 138","Karelia Дуб Natur New Arctic 138"
4391,"доска Karelia Дуб Story Brashed New Arctic","Karelia Дуб Story Brashed New Arctic"
4390,"доска Karelia Дуб Story Ivory Stonewashed","Karelia Дуб Story Ivory Stonewashed"
4394,"доска Karelia Дуб Story Brashed New Arctic","Karelia Дуб Story Brashed New Arctic"
4392,"доска Karelia Дуб Natur New Arctic 188","Karelia Дуб Natur New Arctic 188"
4393,"доска Karelia Дуб Ivory Stonewashed 188","Karelia Дуб Ivory Stonewashed 188"
4396,"доска Karelia Дуб Story Cinder Dark","Karelia Дуб Story Cinder Dark"
4395,"доска Karelia Дуб Story Burnt Sienna","Karelia Дуб Story Burnt Sienna"
4397,"доска Karelia Дуб Story Grain Brown","Karelia Дуб Story Grain Brown"
4398,"доска Karelia Дуб Story Misty Grey","Karelia Дуб Story Misty Grey"
4399,"доска Karelia Дуб Story Sandy White","Karelia Дуб Story Sandy White"
4400,"доска Karelia Дуб Story Salted Liquorice","Karelia Дуб Story Salted Liquorice"
4401,"доска Karelia Дуб Aged Silky","Karelia Дуб Aged Silky"
4402,"доска Karelia Дуб Stonewashed Platinum","Karelia Дуб Stonewashed Platinum"
4403,"доска Karelia Дуб Aged Stonewashed Ivory","Karelia Дуб Aged Stonewashed Ivory"
4406,"доска Karelia Дуб Oregon","Karelia Дуб Oregon"
4404,"доска Karelia Дуб 138 Country","Karelia Дуб 138 Country"
4405,"доска Karelia Дуб 138 Natur","Karelia Дуб 138 Natur"
4407,"доска Karelia Дуб 138 Natur Matt","Karelia Дуб 138 Natur Matt"
4410,"доска Karelia Дуб Story","Karelia Дуб Story"
4408,"доска Karelia Дуб 138 Story","Karelia Дуб 138 Story"
4412,"доска Karelia Дуб Shoreline White","Karelia Дуб Shoreline White"
4409,"доска Karelia Дуб 188 Natur","Karelia Дуб 188 Natur"
4415,"доска Karelia Ясень full plank 138 Story Shiny White","Karelia Ясень full plank 138 Story Shiny White"
4413,"доска Karelia Дуб Sugar","Karelia Дуб Sugar"
4411,"доска Karelia Дуб Electric Light","Karelia Дуб Electric Light"
4414,"доска Karelia Дуб full plank Shadow Grey","Karelia Дуб full plank Shadow Grey"
4416,"доска Karelia Дуб full plank Electric Light","Karelia Дуб full plank Electric Light"
4417,"доска Karelia Дуб full plank Story Sugar","Karelia Дуб full plank Story Sugar"
4418,"доска Karelia Дуб Darc Chocolate 138","Karelia Дуб Darc Chocolate 138"
4419,"доска Karelia Дуб Oregano","Karelia Дуб Oregano"
4420,"доска Karelia Дуб Darc Chocolate 188","Karelia Дуб Darc Chocolate 188"
4422,"доска Karelia Ясень 188 Country Vanilla Matt","Karelia Ясень 188 Country Vanilla Matt"
4425,"доска Karelia Ясень 138 Select Arctic","Karelia Ясень 138 Select Arctic"
4424,"доска Karelia Ясень 138 Country Arctic","Karelia Ясень 138 Country Arctic"
4426,"доска Karelia Дуб full plank 138 Black Pepper","Karelia Дуб full plank 138 Black Pepper"
4423,"доска Karelia Ясень 138 Country Vanilla Matt","Karelia Ясень 138 Country Vanilla Matt"
4427,"доска Karelia Дуб full plank Stonewashed Charcoal","Karelia Дуб full plank Stonewashed Charcoal"
4428,"доска Karelia Дуб Smoked Almond","Karelia Дуб Smoked Almond"
4429,"доска Karelia Дуб full plank 138 Narur Antique","Karelia Дуб full plank 138 Narur Antique"
4431,"доска Karelia Дуб full plank 138 Story Stonewashed Milk Cocoa","Karelia Дуб full plank 138 Story Stonewashed Milk Cocoa"
4430,"доска Karelia Дуб Smoked Truffle","Karelia Дуб Smoked Truffle"
4432,"доска Karelia Дуб full plank Story Brushed Antique","Karelia Дуб full plank Story Brushed Antique"
4433,"доска Karelia Дуб full plank Black Pepper","Karelia Дуб full plank Black Pepper"
4435,"доска Karelia Дуб Story Smoked Truffle","Karelia Дуб Story Smoked Truffle"
4434,"доска Karelia Дуб Story Smoked Almond","Karelia Дуб Story Smoked Almond"
4436,"доска Karelia Дуб full plank 138 Story Stonewashed Country Presence","Karelia Дуб full plank 138 Story Stonewashed Country Presence"
4438,"доска Karelia Дуб full plank 138 Storu Country Vintage Silky","Karelia Дуб full plank 138 Storu Country Vintage Silky"
4437,"доска Karelia Дуб full plank 138 Story Stonewashed Country Vision","Karelia Дуб full plank 138 Story Stonewashed Country Vision"
4439,"доска Karelia Дуб Concerte Grey","Karelia Дуб Concerte Grey"
4421,"доска Karelia Дуб Smoked Matt","Karelia Дуб Smoked Matt"
4440,"доска Karelia Дуб full plank Story Railroad Grey","Karelia Дуб full plank Story Railroad Grey"
4441,"доска Karelia Дуб full plank Promenade Grey","Karelia Дуб full plank Promenade Grey"
4444,"доска Karelia Дуб full plank Story Smoked Roastery Brown","Karelia Дуб full plank Story Smoked Roastery Brown"
4442,"доска Karelia Дуб full plank Concerte Grey","Karelia Дуб full plank Concerte Grey"
4443,"доска Karelia Дуб full plank Story Smoked Docklands Brown","Karelia Дуб full plank Story Smoked Docklands Brown"
4446,"доска Karelia Ясень full plank 138 Blue Lily","Karelia Ясень full plank 138 Blue Lily"
4445,"доска Karelia Дуб full plank Story Smoked Asphalt Grey","Karelia Дуб full plank Story Smoked Asphalt Grey"
4447,"доска Karelia Ясень full plank 138 Pale Peach","Karelia Ясень full plank 138 Pale Peach"
4448,"доска Karelia Ясень full plank 138 Story Mint","Karelia Ясень full plank 138 Story Mint"
4449,"доска Karelia Ясень full plank 138 Story Pink Primrose","Karelia Ясень full plank 138 Story Pink Primrose"
4451,"доска Boen-Hohns Дуб Pearl Finale  масло NaturalPlus","Boen-Hohns Дуб Pearl Finale  масло NaturalPlus"
4450,"доска Boen-Hohns Дуб Marron steamed Сатиновый лак","Boen-Hohns Дуб Marron steamed Сатиновый лак"
4452,"доска Boen-Hohns Дуб Vivo масло","Boen-Hohns Дуб Vivo масло"
4454,"доска Boen-Hohns Дуб Andante матовый лак","Boen-Hohns Дуб Andante матовый лак"
4453,"доска Boen-Hohns Дуб белый concerto масло NaturalPlus","Boen-Hohns Дуб белый concerto масло NaturalPlus"
4457,"доска Boen-Hohns Дуб Sand 138 мм","Boen-Hohns Дуб Sand 138 мм"
4455,"доска Boen-Hohns Ясень Andante Сатиновый лак","Boen-Hohns Ясень Andante Сатиновый лак"
4458,"доска Boen-Hohns Дуб Old grey 138 мм","Boen-Hohns Дуб Old grey 138 мм"
4456,"доска Boen-Hohns Дуб Pearl 138 мм","Boen-Hohns Дуб Pearl 138 мм"
4459,"доска Boen-Hohns Дуб Alamo 138 мм","Boen-Hohns Дуб Alamo 138 мм"
4460,"доска Boen-Hohns Дуб Moon 138 мм","Boen-Hohns Дуб Moon 138 мм"
4461,"доска Boen-Hohns Дуб Barrel 138 мм","Boen-Hohns Дуб Barrel 138 мм"
4462,"доска Boen-Hohns Дуб Graphite 138 мм","Boen-Hohns Дуб Graphite 138 мм"
4463,"доска Boen-Hohns Дуб Coral 138 мм","Boen-Hohns Дуб Coral 138 мм"
4464,"доска Boen-Hohns Дуб Pearl  209 мм Castle","Boen-Hohns Дуб Pearl  209 мм Castle"
4466,"доска Boen-Hohns Дуб Shadow 138 мм","Boen-Hohns Дуб Shadow 138 мм"
4465,"доска Boen-Hohns Дуб Sand  209 мм Castle","Boen-Hohns Дуб Sand  209 мм Castle"
4473,"доска Boen-Hohns Дуб Lava 138 мм","Boen-Hohns Дуб Lava 138 мм"
4470,"доска Boen-Hohns Дуб Amber  209 мм Castle","Boen-Hohns Дуб Amber  209 мм Castle"
4468,"доска Boen-Hohns Дуб Coral  209 мм Castle","Boen-Hohns Дуб Coral  209 мм Castle"
4471,"доска Boen-Hohns Дуб Moon  209 мм Castle","Boen-Hohns Дуб Moon  209 мм Castle"
4472,"доска Boen-Hohns Дуб Earth  209 мм Castle","Boen-Hohns Дуб Earth  209 мм Castle"
4474,"доска Boen-Hohns Дуб Ivory 209 мм Castle","Boen-Hohns Дуб Ivory 209 мм Castle"
4475,"доска Boen-Hohns Дуб Stone 138 мм","Boen-Hohns Дуб Stone 138 мм"
4476,"доска Boen-Hohns Дуб Barrel  209 мм Castle","Boen-Hohns Дуб Barrel  209 мм Castle"
4477,"доска Boen-Hohns Дуб Graphite  209 мм Castle","Boen-Hohns Дуб Graphite  209 мм Castle"
4478,"доска Boen-Hohns Дуб Shadow  209 мм Castle","Boen-Hohns Дуб Shadow  209 мм Castle"
4482,"доска Boen-Hohns Дуб White Nights","Boen-Hohns Дуб White Nights"
4480,"доска Boen-Hohns Дуб Indian Summer","Boen-Hohns Дуб Indian Summer"
4481,"доска Boen-Hohns Дуб Golden Valley","Boen-Hohns Дуб Golden Valley"
4483,"доска Boen-Hohns Дуб Blue Moon","Boen-Hohns Дуб Blue Moon"
4484,"доска Boen-Hohns Дуб Mystic Jungle","Boen-Hohns Дуб Mystic Jungle"
4485,"доска Boen-Hohns Дуб Sandy Grey","Boen-Hohns Дуб Sandy Grey"
4486,"доска Boen-Hohns Дуб Shabby Cream","Boen-Hohns Дуб Shabby Cream"
4487,"доска Boen-Hohns Дуб Shabby White","Boen-Hohns Дуб Shabby White"
4488,"доска Boen-Hohns Дуб натур лак","Boen-Hohns Дуб натур лак"
4489,"доска Boen-Hohns Дуб белый лак","Boen-Hohns Дуб белый лак"
4490,"доска Boen-Hohns Дуб натур масло","Boen-Hohns Дуб натур масло"
4491,"доска Boen-Hohns Дуб белый масло","Boen-Hohns Дуб белый масло"
4494,"доска Boen-Hohns Дуб Arizona","Boen-Hohns Дуб Arizona"
4492,"доска Boen-Hohns Дуб дымчатый лак","Boen-Hohns Дуб дымчатый лак"
4493,"доска Boen-Hohns Дуб дымчатый масло","Boen-Hohns Дуб дымчатый масло"
4496,"доска Boen-Hohns Дуб белый Animoso  лак","Boen-Hohns Дуб белый Animoso  лак"
4497,"доска Boen-Hohns Дуб Animoso масло","Boen-Hohns Дуб Animoso масло"
4495,"доска Boen-Hohns Дуб Animoso матовый лак","Boen-Hohns Дуб Animoso матовый лак"
4499,"доска Boen-Hohns Дуб Animoso масло, браш","Boen-Hohns Дуб Animoso масло, браш"
4498,"доска Boen-Hohns Дуб белый Animoso масло","Boen-Hohns Дуб белый Animoso масло"
4501,"доска Boen-Hohns Дуб Andante матовый лак","Boen-Hohns Дуб Andante матовый лак"
4500,"доска Boen-Hohns Дуб Old Grey","Boen-Hohns Дуб Old Grey"
4503,"доска Boen-Hohns Дуб Pearl","Boen-Hohns Дуб Pearl"
4502,"доска Boen-Hohns Дуб белый Andante лак","Boen-Hohns Дуб белый Andante лак"
4504,"доска Boen-Hohns Дуб Andante масло","Boen-Hohns Дуб Andante масло"
4506,"доска Boen-Hohns Дуб Sand","Boen-Hohns Дуб Sand"
4507,"доска Boen-Hohns Дуб Сoral","Boen-Hohns Дуб Сoral"
4505,"доска Boen-Hohns Дуб белый Andante масло","Boen-Hohns Дуб белый Andante масло"
4509,"доска Boen-Hohns Дуб Andante масло, браш","Boen-Hohns Дуб Andante масло, браш"
4508,"доска Boen-Hohns Дуб Graphite","Boen-Hohns Дуб Graphite"
4510,"доска Boen-Hohns Дуб Lava","Boen-Hohns Дуб Lava"
4512,"доска Boen-Hohns Дуб копченый масло","Boen-Hohns Дуб копченый масло"
4511,"доска Boen-Hohns Дуб Stone","Boen-Hohns Дуб Stone"
4514,"доска Boen-Hohns Американский орех Andante лак","Boen-Hohns Американский орех Andante лак"
4513,"доска Boen-Hohns Американский орех Animoso лак","Boen-Hohns Американский орех Animoso лак"
4516,"доска Boen-Hohns Дуб Animoso Live Pure","Boen-Hohns Дуб Animoso Live Pure"
4517,"доска Boen-Hohns Орех американский Andante Live Pure","Boen-Hohns Орех американский Andante Live Pure"
4515,"доска Boen-Hohns Американский орех Andante масло","Boen-Hohns Американский орех Andante масло"
4518,"доска Boen-Hohns Дуб Vivo матовый лак","Boen-Hohns Дуб Vivo матовый лак"
4519,"доска Boen-Hohns Дуб Vivo масло","Boen-Hohns Дуб Vivo масло"
4520,"доска Boen-Hohns Дуб Vivo масло, браш","Boen-Hohns Дуб Vivo масло, браш"
4521,"доска Boen-Hohns Ясень Animoso сатиновый лак","Boen-Hohns Ясень Animoso сатиновый лак"
