1257,"паркет Siberian Floor Дуб морёный, лак УФ МОДУЛЬ № 12","Siberian Floor Дуб морёный, лак УФ МОДУЛЬ № 12"
1258,"паркет Siberian Floor Дуб морёный, лак УФ МОДУЛЬ № 14","Siberian Floor Дуб морёный, лак УФ МОДУЛЬ № 14"
1262,"доска Kahrs Клён весна (Лодж)","Kahrs Клён весна (Лодж)"
1259,"паркет Siberian Floor Дуб морёный, лак УФ МОДУЛЬ № 2","Siberian Floor Дуб морёный, лак УФ МОДУЛЬ № 2"
1261,"паркет Siberian Floor Дуб цвет Антрацит, лак УФ МОДУЛЬ №11","Siberian Floor Дуб цвет Антрацит, лак УФ МОДУЛЬ №11"
1263,"доска Kahrs Орех Цветок (Лодж)","Kahrs Орех Цветок (Лодж)"
1264,"доска Kahrs Вишня Зима (Лодж)","Kahrs Вишня Зима (Лодж)"
1265,"доска Kahrs Клён Крем (Ливинг)","Kahrs Клён Крем (Ливинг)"
1260,"паркет Siberian Floor Дуб морёный, масло OSMO МОДУЛЬ № 3","Siberian Floor Дуб морёный, масло OSMO МОДУЛЬ № 3"
1267,"доска Kahrs Дуб Башня матовый лак (Хабитэт)","Kahrs Дуб Башня матовый лак (Хабитэт)"
1266,"доска Kahrs Дуб Сахар (Ливинг)","Kahrs Дуб Сахар (Ливинг)"
1269,"доска Kahrs Орех Какао (Ливинг)","Kahrs Орех Какао (Ливинг)"
1268,"доска Kahrs Дуб Башня натуральное масло (Хабитэт)","Kahrs Дуб Башня натуральное масло (Хабитэт)"
1270,"доска Kahrs Дуб Кофе (Ливинг)","Kahrs Дуб Кофе (Ливинг)"
1272,"доска Kahrs Орех Статуя матовый лак (Хабитэт)","Kahrs Орех Статуя матовый лак (Хабитэт)"
1271,"доска Kahrs Дуб Бисквит (Ливинг)","Kahrs Дуб Бисквит (Ливинг)"
1273,"доска Kahrs Орех Статуя натуральное масло (Хабитэт)","Kahrs Орех Статуя натуральное масло (Хабитэт)"
1274,"доска Kahrs Дуб Собор (Хабитэт)","Kahrs Дуб Собор (Хабитэт)"
1275,"доска Kahrs Дуб Замок (Хабитэт)","Kahrs Дуб Замок (Хабитэт)"
1276,"доска Kahrs Дуб Ворота матовый лак (Хабитэт)","Kahrs Дуб Ворота матовый лак (Хабитэт)"
1277,"доска Kahrs Дуб Ворота натуральное масло (Хабитэт)","Kahrs Дуб Ворота натуральное масло (Хабитэт)"
1278,"доска Par-Ky Дуб Bronze brushed PB107","Par-Ky Дуб Bronze brushed PB107"
1279,"доска Par-Ky Дуб Chocolate brushed PB108","Par-Ky Дуб Chocolate brushed PB108"
1280,"доска Par-Ky Дуб Antique brushed PB106","Par-Ky Дуб Antique brushed PB106"
1282,"доска Par-Ky Ятоба LS308","Par-Ky Ятоба LS308"
1283,"доска Par-Ky Дуб Ivory  brushed LB102","Par-Ky Дуб Ivory  brushed LB102"
1284,"доска Par-Ky Дуб Milk brushed LB103","Par-Ky Дуб Milk brushed LB103"
1285,"доска Par-Ky Дуб Desert brushed LB104","Par-Ky Дуб Desert brushed LB104"
1281,"доска Par-Ky Дуб европейский brushed LB101","Par-Ky Дуб европейский brushed LB101"
1287,"доска Par-Ky Дуб Bronze brushed LB107","Par-Ky Дуб Bronze brushed LB107"
1286,"доска Par-Ky Дуб Mystery  brushed LB105","Par-Ky Дуб Mystery  brushed LB105"
1288,"доска Par-Ky Дуб Chocolate brushed LB108","Par-Ky Дуб Chocolate brushed LB108"
1290,"доска Par-Ky Бамбук темный LS307","Par-Ky Бамбук темный LS307"
1291,"доска Par-Ky Сукупира LS303","Par-Ky Сукупира LS303"
1289,"доска Par-Ky Бук Coffe LS204","Par-Ky Бук Coffe LS204"
1292,"доска Par-Ky Ясень Sand brushed  LB201","Par-Ky Ясень Sand brushed  LB201"
1293,"доска Par-Ky Ясень Golden brushed LB202","Par-Ky Ясень Golden brushed LB202"
1294,"доска Par-Ky Орех Smoked LS203","Par-Ky Орех Smoked LS203"
1295,"доска Par-Ky Афзелия brushed LB302","Par-Ky Афзелия brushed LB302"
1297,"доска Par-Ky Santos Палисандр LS306","Par-Ky Santos Палисандр LS306"
1296,"доска Par-Ky Тик LS304","Par-Ky Тик LS304"
1298,"доска Par-Ky Венге brushed LB301","Par-Ky Венге brushed LB301"
1299,"доска Par-Ky Зебрано LS312","Par-Ky Зебрано LS312"
1300,"доска Par-Ky Shadow Макассар LS305","Par-Ky Shadow Макассар LS305"
1302,"доска Kahrs Дуб Лес","Kahrs Дуб Лес"
1301,"доска Kahrs Дуб Риф","Kahrs Дуб Риф"
1303,"доска Kahrs Дуб Арктика","Kahrs Дуб Арктика"
1304,"доска Kahrs Орех Фруктовый сад","Kahrs Орех Фруктовый сад"
1305,"доска Kahrs Орех Сад","Kahrs Орех Сад"
1308,"доска Par-Ky Дуб Milk brushed SB+103","Par-Ky Дуб Milk brushed SB+103"
1307,"доска Par-Ky Дуб Ivory  brushed SB+102","Par-Ky Дуб Ivory  brushed SB+102"
1309,"доска Par-Ky Дуб Desert brushed SB+104","Par-Ky Дуб Desert brushed SB+104"
1306,"доска Par-Ky Дуб европейский brushed SB+101","Par-Ky Дуб европейский brushed SB+101"
1310,"доска Par-Ky Дуб Mystery brushed SB+105","Par-Ky Дуб Mystery brushed SB+105"
1312,"доска Par-Ky Бук Coffe SS+204","Par-Ky Бук Coffe SS+204"
1311,"доска Par-Ky Дуб Chocolate brushed SB+108","Par-Ky Дуб Chocolate brushed SB+108"
1313,"доска Baum Дуб Селект Глянец","Baum Дуб Селект Глянец"
1314,"доска Baum Дуб Браш Селект","Baum Дуб Браш Селект"
1315,"доска Par-Ky Ясень Golden brushed SB+202","Par-Ky Ясень Golden brushed SB+202"
1316,"доска Baum Дуб Копченый белый","Baum Дуб Копченый белый"
1317,"доска Baum Дуб Дымчатый глянец","Baum Дуб Дымчатый глянец"
1319,"доска Baum Дуб Антик","Baum Дуб Антик"
1320,"доска Baum Дуб Латте","Baum Дуб Латте"
1321,"доска Baum Дуб Робусто","Baum Дуб Робусто"
1323,"доска Baum Дуб Капучино","Baum Дуб Капучино"
1322,"доска Baum Дуб Ампир","Baum Дуб Ампир"
1324,"доска Baum Дуб Милк","Baum Дуб Милк"
1325,"доска Baum Ясень Белый","Baum Ясень Белый"
1326,"доска Baum Ясень Барокко","Baum Ясень Барокко"
1327,"доска Baum Ясень Сахара","Baum Ясень Сахара"
1328,"доска Baum Ясень Жемчуг","Baum Ясень Жемчуг"
1329,"доска Baum Сапеле","Baum Сапеле"
1330,"доска Kahrs Дуб Эрве","Kahrs Дуб Эрве"
1331,"доска Kahrs Ясень Вайла","Kahrs Ясень Вайла"
1333,"доска Boen-Hohns Дуб City","Boen-Hohns Дуб City"
1332,"доска Kahrs Дуб Лекко сатиновый лак","Kahrs Дуб Лекко сатиновый лак"
1334,"доска Kahrs Дуб Лекко матовый лак","Kahrs Дуб Лекко матовый лак"
1335,"доска Kahrs Ясень Чериале","Kahrs Ясень Чериале"
1336,"доска Kahrs Дуб Супай","Kahrs Дуб Супай"
1337,"доска Kahrs Дуб красный Натур","Kahrs Дуб красный Натур"
1338,"доска Kahrs Дуб Бисби","Kahrs Дуб Бисби"
1339,"доска Kahrs Дуб Абетон","Kahrs Дуб Абетон"
1340,"доска Kahrs Дуб Пима","Kahrs Дуб Пима"
1341,"доска Grabo Дуб Бургундский натур","Grabo Дуб Бургундский натур"
1342,"доска Grabo Дуб Бургундский Антик","Grabo Дуб Бургундский Антик"
1343,"доска Grabo Дуб Антик","Grabo Дуб Антик"
1344,"доска Grabo Ясень Браш Черный лак","Grabo Ясень Браш Черный лак"
1345,"доска Grabo Ясень Браш белый лак","Grabo Ясень Браш белый лак"
1346,"доска Grabo Дуб Какао","Grabo Дуб Какао"
1348,"доска Grabo Дуб Бренди","Grabo Дуб Бренди"
1347,"доска Grabo Дуб Хони","Grabo Дуб Хони"
1349,"доска Grabo Дуб Айс Вайт","Grabo Дуб Айс Вайт"
1350,"доска Grabo Дуб Браш черный лак","Grabo Дуб Браш черный лак"
1351,"доска Grabo Дуб Браш белый лак","Grabo Дуб Браш белый лак"
1352,"доска Grabo Мербау Браш черный лак","Grabo Мербау Браш черный лак"
1353,"доска Grabo Венге Экселент","Grabo Венге Экселент"
1354,"доска Grabo Венге браш белый лак","Grabo Венге браш белый лак"
1355,"доска Barlinek Дуб Wolfsburg","Barlinek Дуб Wolfsburg"
1356,"доска Barlinek Дуб Ascania","Barlinek Дуб Ascania"
1358,"доска Barlinek Дуб Golden Spike","Barlinek Дуб Golden Spike"
1357,"доска Barlinek Ясень Milkshake","Barlinek Ясень Milkshake"
1359,"доска Polarwood Дуб Орегон","Polarwood Дуб Орегон"
1360,"доска Coswick Ясень Французская ривьера (French Riviera)","Coswick Ясень Французская ривьера (French Riviera)"
1361,"доска Coswick Дуб Розовый","Coswick Дуб Розовый"
1362,"доска Par-Ky Дуб европейский brushed DB+101","Par-Ky Дуб европейский brushed DB+101"
1363,"доска Kahrs Дуб Ницца (Спецпрограмма)","Kahrs Дуб Ницца (Спецпрограмма)"
1364,"доска Kahrs Дуб Комо (Спецпрограмма)","Kahrs Дуб Комо (Спецпрограмма)"
1365,"доска Par-Ky Дуб Mystery brushed DB+105","Par-Ky Дуб Mystery brushed DB+105"
1366,"доска Par-Ky Дуб Milk brushed DB+103","Par-Ky Дуб Milk brushed DB+103"
1368,"доска Par-Ky Дуб Bronze brushed DB+107","Par-Ky Дуб Bronze brushed DB+107"
1367,"доска Par-Ky Дуб Desert brushed DB+104","Par-Ky Дуб Desert brushed DB+104"
1369,"доска Par-Ky Дуб Chocolate brushed DB+108","Par-Ky Дуб Chocolate brushed DB+108"
1370,"доска Kahrs Дуб Сиена сатиновый лак (Европейская коллекция)","Kahrs Дуб Сиена сатиновый лак (Европейская коллекция)"
1371,"доска Kahrs Дуб Сиена натуральное масло (Европейская коллекция)","Kahrs Дуб Сиена натуральное масло (Европейская коллекция)"
1372,"доска Kahrs Дуб Сиена матовый лак (Европейская коллекция)","Kahrs Дуб Сиена матовый лак (Европейская коллекция)"
1373,"доска Kahrs Бук Виборг сатиновый лак (Скандинавская коллекция)","Kahrs Бук Виборг сатиновый лак (Скандинавская коллекция)"
1375,"доска Par-Ky Ясень Sand brushed DB+201","Par-Ky Ясень Sand brushed DB+201"
1374,"доска Kahrs Бук Виборг натуральное масло (Скандинавская коллекция)","Kahrs Бук Виборг натуральное масло (Скандинавская коллекция)"
1377,"доска Kahrs Ясень Кальмар матовый лак (Скандинавская коллекция)","Kahrs Ясень Кальмар матовый лак (Скандинавская коллекция)"
1378,"доска Coswick Зебрано (Ясень)","Coswick Зебрано (Ясень)"
1379,"доска Coswick Зебрано (Дуб)","Coswick Зебрано (Дуб)"
1380,"доска Boen-Hohns Бук","Boen-Hohns Бук"
1381,"доска Boen-Hohns Ясень","Boen-Hohns Ясень"
1382,"доска Boen-Hohns Дуб","Boen-Hohns Дуб"
1383,"доска Boen-Hohns Клён канадский","Boen-Hohns Клён канадский"
1384,"доска Greenline Дуб Копченый Белый","Greenline Дуб Копченый Белый"
1385,"доска Greenline Дуб Робусто","Greenline Дуб Робусто"
1386,"доска Greenline Дуб Королевский","Greenline Дуб Королевский"
1387,"доска Greenline Дуб Белый Шёлк","Greenline Дуб Белый Шёлк"
1389,"доска Greenline Дуб Коньячный","Greenline Дуб Коньячный"
1388,"доска Greenline Дуб Дымчатый","Greenline Дуб Дымчатый"
1390,"доска Greenline Ясень Термо","Greenline Ясень Термо"
1391,"доска Greenline Ясень Термо Тёмный","Greenline Ясень Термо Тёмный"
1392,"доска Greenline Ясень Термо Светлый","Greenline Ясень Термо Светлый"
1394,"доска Mazarri Дуб Шоколад","Mazarri Дуб Шоколад"
1393,"доска Greenline Орех Американский","Greenline Орех Американский"
1395,"доска Mazarri Дуб Натур","Mazarri Дуб Натур"
1396,"доска Mazarri Ясень Шоколад","Mazarri Ясень Шоколад"
1398,"доска Mazarri Ясень Песочный 2-пол.","Mazarri Ясень Песочный 2-пол."
1399,"доска Mazarri Дуб Коньяк 2-пол.","Mazarri Дуб Коньяк 2-пол."
1397,"доска Mazarri Ясень Коньяк 2-пол.","Mazarri Ясень Коньяк 2-пол."
1400,"доска Mazarri Дуб Шоколад 2-пол.","Mazarri Дуб Шоколад 2-пол."
1401,"доска Mazarri Дуб Натур 2-пол.","Mazarri Дуб Натур 2-пол."
1402,"доска Mazarri Дуб Песочный 2-пол.","Mazarri Дуб Песочный 2-пол."
1404,"доска Polarwood Ясень Плутон","Polarwood Ясень Плутон"
1403,"доска Mazarri Орех Американский","Mazarri Орех Американский"
1405,"доска Polarwood Ясень Сатурн","Polarwood Ясень Сатурн"
1406,"доска Polarwood Ясень Луна","Polarwood Ясень Луна"
1407,"доска Polarwood Ясень Марс","Polarwood Ясень Марс"
1408,"доска Polarwood Дуб Уран","Polarwood Дуб Уран"
1409,"доска Polarwood Дуб Нептун","Polarwood Дуб Нептун"
1410,"доска Polarwood Дуб Кальвадос","Polarwood Дуб Кальвадос"
1411,"доска Polarwood Дуб Юпитер","Polarwood Дуб Юпитер"
1412,"доска Polarwood Дуб Дарк Браун","Polarwood Дуб Дарк Браун"
1413,"доска Polarwood Дуб Тундра беленый","Polarwood Дуб Тундра беленый"
1414,"доска Polarwood Дуб Коттедж","Polarwood Дуб Коттедж"
1415,"доска Polarwood Дуб Меркурий","Polarwood Дуб Меркурий"
1416,"доска Polarwood Дуб Орегон","Polarwood Дуб Орегон"
1417,"доска Polarwood Дуб Купидон","Polarwood Дуб Купидон"
1419,"доска Polarwood Дуб Элара","Polarwood Дуб Элара"
1418,"доска Polarwood Дуб Протей","Polarwood Дуб Протей"
1420,"доска Polarwood Дуб Карме","Polarwood Дуб Карме"
1421,"доска Upofloor Дуб Granite  СЛ 3-полосный 3,41м2/уп","Upofloor Дуб Granite  СЛ 3-полосный 3,41м2/уп"
1422,"доска Upofloor Дуб Венге СЛ 3,41м2/уп 3-полосный","Upofloor Дуб Венге СЛ 3,41м2/уп 3-полосный"
1423,"доска Upofloor Дуб Select  СЛ 3,41 м2/уп","Upofloor Дуб Select  СЛ 3,41 м2/уп"
1424,"доска Upofloor Ясень Натур 3-полосный СЛ 3,41м2/уп.","Upofloor Ясень Натур 3-полосный СЛ 3,41м2/уп."
1426,"доска Upofloor Дуб Мокка  НМЦ/Б 3,41м2уп. 3-полосный","Upofloor Дуб Мокка  НМЦ/Б 3,41м2уп. 3-полосный"
1427,"доска Upofloor Ясень Натур  Marble Matt МЛБ 3-полосный 3,41м2/уп.","Upofloor Ясень Натур  Marble Matt МЛБ 3-полосный 3,41м2/уп."
1428,"доска Upofloor Дуб Селект White Oiled НМБ 3-полосный","Upofloor Дуб Селект White Oiled НМБ 3-полосный"
1430,"доска Upofloor Дуб Селект OILED 3-полосный 3,41м2/уп","Upofloor Дуб Селект OILED 3-полосный 3,41м2/уп"
1429,"доска Upofloor Дуб Селект Marble Matt  3-полосный МЛБ 3,41м2/уп.","Upofloor Дуб Селект Marble Matt  3-полосный МЛБ 3,41м2/уп."
1431,"доска Upofloor Дуб CAPPUCINO 3-полосный НМЦ/Б 3,41м2/уп","Upofloor Дуб CAPPUCINO 3-полосный НМЦ/Б 3,41м2/уп"
1432,"доска Upofloor Дуб White Marble СЛ","Upofloor Дуб White Marble СЛ"
1433,"доска Upofloor Дуб  Thunder Cloud НМБ/Б","Upofloor Дуб  Thunder Cloud НМБ/Б"
1434,"доска Upofloor Дуб Silver Mist НМЦ/Б","Upofloor Дуб Silver Mist НМЦ/Б"
1435,"доска Upofloor Дуб Frost НМЦ/Б","Upofloor Дуб Frost НМЦ/Б"
1436,"доска Upofloor Мербау СЛ 3,41м2/уп. 3-полосный","Upofloor Мербау СЛ 3,41м2/уп. 3-полосный"
1437,"доска Upofloor Дуб Кантри СЛ 2,2м2/уп 1-полосный","Upofloor Дуб Кантри СЛ 2,2м2/уп 1-полосный"
1438,"доска Upofloor Дуб  Натур СЛ 1-полосный 2,0/2,2м2/уп","Upofloor Дуб  Натур СЛ 1-полосный 2,0/2,2м2/уп"
1439,"доска Amber Wood Ясень Капучино","Amber Wood Ясень Капучино"
1440,"доска Amber Wood Ясень Натур лак","Amber Wood Ясень Натур лак"
1441,"доска Amber Wood Ясень Селект лак","Amber Wood Ясень Селект лак"
1442,"доска Amber Wood Ясень Коньяк","Amber Wood Ясень Коньяк"
1443,"доска Amber Wood Дуб Миндаль","Amber Wood Дуб Миндаль"
1444,"доска Amber Wood Ясень Жемчужный","Amber Wood Ясень Жемчужный"
1445,"доска Amber Wood Дуб Бурбон","Amber Wood Дуб Бурбон"
1446,"доска Amber Wood Дуб Махагон","Amber Wood Дуб Махагон"
1447,"доска Amber Wood Дуб Мускат","Amber Wood Дуб Мускат"
1449,"доска Amber Wood Дуб Шампань","Amber Wood Дуб Шампань"
1450,"доска Amber Wood Дуб Слоновая кость","Amber Wood Дуб Слоновая кость"
1451,"доска Amber Wood Дуб Капучино","Amber Wood Дуб Капучино"
1452,"доска Amber Wood Ясень Натур лак","Amber Wood Ясень Натур лак"
1453,"доска Amber Wood Ясень Шоколад","Amber Wood Ясень Шоколад"
1454,"доска Amber Wood Ясень кофе","Amber Wood Ясень кофе"
1455,"доска Amber Wood Ясень Натур браш масло","Amber Wood Ясень Натур браш масло"
1456,"доска Amber Wood Дуб Экстра","Amber Wood Дуб Экстра"
1457,"доска Amber Wood Ясень Селект","Amber Wood Ясень Селект"
1458,"доска Baum Дуб Жемчуг","Baum Дуб Жемчуг"
1459,"доска Baum Дуб Шелк Браш","Baum Дуб Шелк Браш"
1460,"доска Baum Ясень Арктик","Baum Ясень Арктик"
1461,"доска Baum Дуб Копченый белый","Baum Дуб Копченый белый"
1462,"доска Baum Дуб Серебро","Baum Дуб Серебро"
1463,"доска Esta Parket Ясень Chestnut","Esta Parket Ясень Chestnut"
1464,"доска Esta Parket Ясень Village White","Esta Parket Ясень Village White"
1465,"доска Esta Parket Ясень Village","Esta Parket Ясень Village"
1466,"доска Esta Parket Дуб Town(natur-select)","Esta Parket Дуб Town(natur-select)"
1467,"доска Esta Parket Дуб Antique","Esta Parket Дуб Antique"
1468,"доска Esta Parket Дуб Ebony Brush","Esta Parket Дуб Ebony Brush"
1469,"доска Esta Parket Бук Shoko","Esta Parket Бук Shoko"
1470,"доска Esta Parket Дуб Village White (natur-white)","Esta Parket Дуб Village White (natur-white)"
1471,"доска Esta Parket Ясень Amaretto Natural Pores Brush","Esta Parket Ясень Amaretto Natural Pores Brush"
1472,"доска Esta Parket Дуб Dusky Grey Brush","Esta Parket Дуб Dusky Grey Brush"
1473,"доска Esta Parket Ясень Elite White (select white)","Esta Parket Ясень Elite White (select white)"
1474,"доска Esta Parket Дуб Bitter Brush","Esta Parket Дуб Bitter Brush"
1476,"доска Esta Parket Дуб Dune White Pores Brush","Esta Parket Дуб Dune White Pores Brush"
1475,"доска Esta Parket Дуб Antracite","Esta Parket Дуб Antracite"
1477,"доска Esta Parket Дуб Ebony Pores","Esta Parket Дуб Ebony Pores"
1478,"доска Esta Parket Дуб Antique  UV-Oil","Esta Parket Дуб Antique  UV-Oil"
1479,"доска Esta Parket Дуб City (select-radial)","Esta Parket Дуб City (select-radial)"
1480,"доска Esta Parket Дуб Rose Ebony Pores Brush","Esta Parket Дуб Rose Ebony Pores Brush"
1481,"доска Esta Parket Дуб Quartz White Pores","Esta Parket Дуб Quartz White Pores"
1482,"доска FocusFloor Дуб Леванте (LEVANTE)","FocusFloor Дуб Леванте (LEVANTE)"
1483,"доска FocusFloor Ясень Грегал (GREGALE)","FocusFloor Ясень Грегал (GREGALE)"
1484,"доска FocusFloor Ясень Техуано (TEHUANO)","FocusFloor Ясень Техуано (TEHUANO)"
1486,"доска FocusFloor Ясень Памперо (PAMPERO)","FocusFloor Ясень Памперо (PAMPERO)"
1485,"доска FocusFloor Ясень Байамо (BAYAMO)","FocusFloor Ясень Байамо (BAYAMO)"
1487,"доска FocusFloor Дуб Бора (BORA)","FocusFloor Дуб Бора (BORA)"
1488,"доска FocusFloor Дуб Калима (CALIMA)","FocusFloor Дуб Калима (CALIMA)"
1489,"доска FocusFloor Дуб Пониенте (PONIENTE)","FocusFloor Дуб Пониенте (PONIENTE)"
1491,"доска FocusFloor Дуб Трамонтана (TRAMONTANA)","FocusFloor Дуб Трамонтана (TRAMONTANA)"
1490,"доска FocusFloor Дуб Санта-Ана (SANTA ANA)","FocusFloor Дуб Санта-Ана (SANTA ANA)"
1493,"доска FocusFloor Дуб Хамсин (KHAMSIN) 1800","FocusFloor Дуб Хамсин (KHAMSIN) 1800"
1492,"доска FocusFloor Дуб Остро (OSTRO)","FocusFloor Дуб Остро (OSTRO)"
1494,"доска FocusFloor Дуб Калима (CALIMA)","FocusFloor Дуб Калима (CALIMA)"
1496,"доска FocusFloor Дуб Шамаль (SHAMAL) 1800","FocusFloor Дуб Шамаль (SHAMAL) 1800"
1495,"доска FocusFloor Дуб Леванте (LEVANTE) 1800","FocusFloor Дуб Леванте (LEVANTE) 1800"
1497,"доска FocusFloor Дуб Эйлиз (ALIZE) 1800","FocusFloor Дуб Эйлиз (ALIZE) 1800"
1498,"доска FocusFloor Дуб Этеcиан (ETESIAN) 1800","FocusFloor Дуб Этеcиан (ETESIAN) 1800"
1499,"доска FocusFloor Дуб Бора (BORA) 1800","FocusFloor Дуб Бора (BORA) 1800"
1500,"доска Barlinek Дуб Bianco","Barlinek Дуб Bianco"
1501,"доска Barlinek Дуб Aurora","Barlinek Дуб Aurora"
1502,"доска Barlinek Дуб Amazon","Barlinek Дуб Amazon"
1503,"доска Barlinek Дуб Mocca","Barlinek Дуб Mocca"
1504,"доска Barlinek Дуб Honey","Barlinek Дуб Honey"
1505,"доска Barlinek Дуб Espresso","Barlinek Дуб Espresso"
1506,"доска Barlinek Ясень Coffee (Кофе)","Barlinek Ясень Coffee (Кофе)"
1507,"доска Barlinek Дуб Tiramisu","Barlinek Дуб Tiramisu"
1508,"доска Barlinek Дуб Banana Song","Barlinek Дуб Banana Song"
1509,"доска Barlinek Дуб Marzipan Muffin","Barlinek Дуб Marzipan Muffin"
1510,"доска Barlinek Дуб Cappucino","Barlinek Дуб Cappucino"
1511,"доска Barlinek Ясень Saimaa Piccolo","Barlinek Ясень Saimaa Piccolo"
1512,"доска Barlinek Дуб Ascania Piccolo","Barlinek Дуб Ascania Piccolo"
1513,"доска Barlinek Тали Sipadan","Barlinek Тали Sipadan"
1514,"доска Barlinek Сапелли (Сапела) Uluru","Barlinek Сапелли (Сапела) Uluru"
1516,"доска Karelia Дуб Curry","Karelia Дуб Curry"
1515,"доска Karelia Дуб Black Pepper","Karelia Дуб Black Pepper"
1517,"доска Karelia Дуб Cinnamon","Karelia Дуб Cinnamon"
1518,"доска Karelia Дуб Antique","Karelia Дуб Antique"
1520,"доска Karelia Дуб Ivory Stonewashed","Karelia Дуб Ivory Stonewashed"
1519,"доска Karelia Дуб Select","Karelia Дуб Select"
1521,"доска Karelia Дуб Stonewashed Ebony","Karelia Дуб Stonewashed Ebony"
1522,"доска Karelia Ясень Natur","Karelia Ясень Natur"
