1779,"доска Coswick Ясень Французская Ривьера / Franch Riviera Классическая","Coswick Ясень Французская Ривьера / Franch Riviera Классическая"
1778,"доска Coswick Ясень Мокка / Mocca  Классическая","Coswick Ясень Мокка / Mocca  Классическая"
1781,"доска Coswick Дуб -  Угольный / Charcoal","Coswick Дуб -  Угольный / Charcoal"
1780,"доска Coswick Дуб -Розовый / Rose","Coswick Дуб -Розовый / Rose"
1782,"доска Coswick Дуб  Антик белый / Antique white Бражированная","Coswick Дуб  Антик белый / Antique white Бражированная"
1784,"доска Coswick Дуб Орех / Chestnut Бражированная","Coswick Дуб Орех / Chestnut Бражированная"
1783,"доска Coswick Дуб  Орех / Chestnut","Coswick Дуб  Орех / Chestnut"
1785,"доска Coswick Дуб Ванильный / Vanilla","Coswick Дуб Ванильный / Vanilla"
1786,"доска Coswick Дуб  Бразильский орех / Walnut","Coswick Дуб  Бразильский орех / Walnut"
1789,"доска Coswick Дуб  Натуральный / Natural Бражированная","Coswick Дуб  Натуральный / Natural Бражированная"
1787,"доска Coswick Дуб  Натуральный / Natural","Coswick Дуб  Натуральный / Natural"
1788,"доска Coswick Дуб  Бразильский орех / Walnut Бражированная","Coswick Дуб  Бразильский орех / Walnut Бражированная"
1790,"доска Coswick Дуб  Темный шоколад / Dark Chocolate Бражированная","Coswick Дуб  Темный шоколад / Dark Chocolate Бражированная"
1791,"доска Coswick Дуб  Белый иней / White Frost Бражированная","Coswick Дуб  Белый иней / White Frost Бражированная"
1792,"доска Global Parquet Дуб Honey Melone (Медовый)","Global Parquet Дуб Honey Melone (Медовый)"
1793,"доска Global Parquet Дуб Tangerine (Мандарин)","Global Parquet Дуб Tangerine (Мандарин)"
1794,"доска Global Parquet Дуб Coffee Grain (Кофейный)","Global Parquet Дуб Coffee Grain (Кофейный)"
1795,"доска Doms Champagne","Doms Champagne"
1796,"доска Doms Termo","Doms Termo"
1797,"доска Bauwerk Дуб Копченый","Bauwerk Дуб Копченый"
1798,"доска Bauwerk Дуб Копченый Farina","Bauwerk Дуб Копченый Farina"
1799,"доска Siberian Floor Дуб Натуральный, лак УФ","Siberian Floor Дуб Натуральный, лак УФ"
1800,"доска Siberian Floor Дуб Серый 2, лак УФ","Siberian Floor Дуб Серый 2, лак УФ"
1801,"доска Siberian Floor Дуб Белый, лак УФ","Siberian Floor Дуб Белый, лак УФ"
1802,"доска Siberian Floor Дуб Серый 2, масло УФ","Siberian Floor Дуб Серый 2, масло УФ"
1803,"доска Siberian Floor Дуб Серый 3, браш, лак УФ","Siberian Floor Дуб Серый 3, браш, лак УФ"
1804,"доска Siberian Floor Дуб Самбре, лак УФ","Siberian Floor Дуб Самбре, лак УФ"
1806,"доска Siberian Floor Дуб Копченый, битый, чёрное масло OSMO","Siberian Floor Дуб Копченый, битый, чёрное масло OSMO"
1805,"доска Siberian Floor Дуб Орегон, масло УФ","Siberian Floor Дуб Орегон, масло УФ"
1807,"доска Siberian Floor Дуб Копченый, чёрное масло OSMO","Siberian Floor Дуб Копченый, чёрное масло OSMO"
1808,"доска Siberian Floor Дуб Копченый, натуральное масло OSMO","Siberian Floor Дуб Копченый, натуральное масло OSMO"
1810,"доска Siberian Floor Дуб Антик, натуральное масло OSMO","Siberian Floor Дуб Антик, натуральное масло OSMO"
1809,"доска Siberian Floor Дуб Копченый, патина черная, натуральное масло УФ","Siberian Floor Дуб Копченый, патина черная, натуральное масло УФ"
1811,"доска Siberian Floor Дуб Белый, патина Белая, лак УФ","Siberian Floor Дуб Белый, патина Белая, лак УФ"
1812,"доска Siberian Floor Дуб Белый, патина белая, масло УФ","Siberian Floor Дуб Белый, патина белая, масло УФ"
1813,"доска Siberian Floor Дуб Натуральный, патина белая, масло УФ","Siberian Floor Дуб Натуральный, патина белая, масло УФ"
1814,"доска Siberian Floor Дуб Копченый, Серый, масло OSMO","Siberian Floor Дуб Копченый, Серый, масло OSMO"
1815,"доска Siberian Floor Дуб Копченый, Забелка, масло УФ","Siberian Floor Дуб Копченый, Забелка, масло УФ"
1816,"доска Siberian Floor Дуб Копченый, Белый, масло OSMO","Siberian Floor Дуб Копченый, Белый, масло OSMO"
1817,"доска Siberian Floor Дуб Платина, принт 1, лак УФ","Siberian Floor Дуб Платина, принт 1, лак УФ"
1818,"доска Mazarri Дуб арт.5513","Mazarri Дуб арт.5513"
1819,"доска Mazarri Дуб арт.5511","Mazarri Дуб арт.5511"
1820,"доска Mazarri Дуб арт.5504","Mazarri Дуб арт.5504"
1821,"доска Mazarri Дуб арт.5508","Mazarri Дуб арт.5508"
1822,"доска Mazarri Дуб арт.5506","Mazarri Дуб арт.5506"
1823,"доска Mazarri Дуб арт.5519","Mazarri Дуб арт.5519"
1824,"доска Mazarri Дуб арт.5507","Mazarri Дуб арт.5507"
1826,"доска Mazarri Дуб арт.5503","Mazarri Дуб арт.5503"
1825,"доска Mazarri Дуб арт.5516","Mazarri Дуб арт.5516"
1829,"доска Mazarri Дуб арт.5502","Mazarri Дуб арт.5502"
1828,"доска Mazarri Дуб арт.5521","Mazarri Дуб арт.5521"
1827,"доска Mazarri Дуб арт.5520","Mazarri Дуб арт.5520"
1830,"паркет Coswick Версаль Дуб Натуральный","Coswick Версаль Дуб Натуральный"
1831,"паркет Coswick Версаль Дуб Барселона","Coswick Версаль Дуб Барселона"
1832,"паркет Coswick Версаль Дуб Марсель","Coswick Версаль Дуб Марсель"
1833,"паркет Coswick Версаль Дуб Старая Венеция","Coswick Версаль Дуб Старая Венеция"
1834,"паркет Coswick Версаль Ясень Неаполь","Coswick Версаль Ясень Неаполь"
1835,"паркет Coswick Версаль Ясень Верона","Coswick Версаль Ясень Верона"
1836,"паркет Coswick Трианон Дуб Натуральный","Coswick Трианон Дуб Натуральный"
1837,"паркет Coswick Трианон Дуб Барселона","Coswick Трианон Дуб Барселона"
1839,"паркет Coswick Трианон Дуб Старая Венеция","Coswick Трианон Дуб Старая Венеция"
1838,"паркет Coswick Трианон Дуб Марсель","Coswick Трианон Дуб Марсель"
1840,"паркет Coswick Трианон Ясень Неаполь","Coswick Трианон Ясень Неаполь"
1841,"паркет Coswick Трианон Ясень Верона","Coswick Трианон Ясень Верона"
1842,"паркет Coswick Ланже Дуб Натуральный","Coswick Ланже Дуб Натуральный"
1843,"паркет Coswick Ланже Дуб Барселона","Coswick Ланже Дуб Барселона"
1844,"паркет Coswick Ланже Дуб Старая Венеция","Coswick Ланже Дуб Старая Венеция"
1845,"паркет Coswick Шеверни Дуб Натуральный","Coswick Шеверни Дуб Натуральный"
1846,"паркет Coswick Шеверни Дуб Барселона","Coswick Шеверни Дуб Барселона"
1847,"паркет Coswick Шеверни Дуб Старая Венеция","Coswick Шеверни Дуб Старая Венеция"
1849,"паркет Coswick Шеверни Дуб/Орех Американский","Coswick Шеверни Дуб/Орех Американский"
1848,"паркет Coswick Ланже Дуб/Орех Американский","Coswick Ланже Дуб/Орех Американский"
1850,"паркет Coswick Версаль Орех Американский Натуральный","Coswick Версаль Орех Американский Натуральный"
1851,"паркет Coswick Трианон Орех Американский Натуральный","Coswick Трианон Орех Американский Натуральный"
1852,"паркет Coswick Ланже Орех Американский Натуральный","Coswick Ланже Орех Американский Натуральный"
1853,"паркет Coswick Шеверни Орех Американский Натуральный","Coswick Шеверни Орех Американский Натуральный"
1854,"доска Mazarri Ясень Ванильный","Mazarri Ясень Ванильный"
1855,"доска Mazarri Дуб Натуральный","Mazarri Дуб Натуральный"
1856,"доска Mazarri Дуб Ванильный","Mazarri Дуб Ванильный"
1857,"доска Mazarri Дуб Беленый","Mazarri Дуб Беленый"
1859,"доска Mazarri Дуб Светлый орех","Mazarri Дуб Светлый орех"
1858,"доска Mazarri Дуб Коньяк","Mazarri Дуб Коньяк"
1860,"доска Mazarri Дуб Андорра","Mazarri Дуб Андорра"
1861,"доска Mazarri Дуб Бьянки Карамель","Mazarri Дуб Бьянки Карамель"
1862,"доска Mazarri Дуб Старинный","Mazarri Дуб Старинный"
1864,"доска Mazarri Дуб Ноче Классик","Mazarri Дуб Ноче Классик"
1863,"доска Mazarri Дуб Янтарный","Mazarri Дуб Янтарный"
1865,"доска Mazarri Дуб Белый Шелк","Mazarri Дуб Белый Шелк"
1866,"доска Mazarri Дуб Аффумикато","Mazarri Дуб Аффумикато"
1867,"доска Mazarri Дуб Креме ди Маре","Mazarri Дуб Креме ди Маре"
1868,"доска Mazarri Дуб Вереск","Mazarri Дуб Вереск"
1869,"доска Mazarri Дуб Нордик","Mazarri Дуб Нордик"
1870,"доска Mazarri Дуб Полярный","Mazarri Дуб Полярный"
1871,"доска Mazarri Дуб Кофе","Mazarri Дуб Кофе"
1873,"доска Mazarri Дуб Ноче Олд","Mazarri Дуб Ноче Олд"
1872,"доска Mazarri Дуб Жемчужный","Mazarri Дуб Жемчужный"
1874,"доска Mazarri Дуб Морроне","Mazarri Дуб Морроне"
1875,"доска Mazarri Дуб Арктик","Mazarri Дуб Арктик"
1876,"доска Mazarri Дуб Морденте","Mazarri Дуб Морденте"
1877,"доска Mazarri Дуб Айсберг","Mazarri Дуб Айсберг"
1879,"доска Global Parquet Дуб Smoke (Смок)","Global Parquet Дуб Smoke (Смок)"
1878,"доска Global Parquet Дуб Citrin (Цитрин)","Global Parquet Дуб Citrin (Цитрин)"
1880,"доска Global Parquet Дуб Pearl (Жемчуг)","Global Parquet Дуб Pearl (Жемчуг)"
1881,"доска Global Parquet Дуб Slate (шифер)","Global Parquet Дуб Slate (шифер)"
1882,"доска Global Parquet Дуб Cappuccino (Капучино)","Global Parquet Дуб Cappuccino (Капучино)"
1884,"доска Global Parquet Дуб Nozize (Нойз)","Global Parquet Дуб Nozize (Нойз)"
1883,"доска Global Parquet Дуб Pecan (Пекан)","Global Parquet Дуб Pecan (Пекан)"
1885,"доска Global Parquet Дуб Rain (Райн)","Global Parquet Дуб Rain (Райн)"
1886,"доска Global Parquet Ясень Blind (Блайнд)","Global Parquet Ясень Blind (Блайнд)"
1887,"доска Global Parquet Ясень Dark Chokolate (Тёмный Шоколад)","Global Parquet Ясень Dark Chokolate (Тёмный Шоколад)"
1889,"доска Global Parquet Укладка Плетёнка","Global Parquet Укладка Плетёнка"
1888,"доска Global Parquet Укладка Шашки","Global Parquet Укладка Шашки"
1890,"доска Global Parquet Укладка Ёлочка","Global Parquet Укладка Ёлочка"
1891,"доска Global Parquet Укладка Лабиринт","Global Parquet Укладка Лабиринт"
1892,"доска Global Parquet Укладка Палуба","Global Parquet Укладка Палуба"
1893,"доска Global Parquet Укладка Палуба","Global Parquet Укладка Палуба"
1894,"доска Greenline Дуб Палермо","Greenline Дуб Палермо"
1896,"доска Greenline Дуб Милан","Greenline Дуб Милан"
1895,"доска Greenline Дуб Мурано","Greenline Дуб Мурано"
1897,"доска Mazarri Дуб Флоренция","Mazarri Дуб Флоренция"
1898,"доска Mazarri Дуб Тоскано","Mazarri Дуб Тоскано"
1899,"доска Mazarri Дуб Кьянти","Mazarri Дуб Кьянти"
1900,"доска Mazarri Дуб Неаполь","Mazarri Дуб Неаполь"
1901,"доска Mazarri Дуб Сицилия","Mazarri Дуб Сицилия"
1902,"доска Mazarri Дуб Барселона","Mazarri Дуб Барселона"
1903,"доска Mazarri Дуб Валенсия","Mazarri Дуб Валенсия"
1904,"доска Mazarri Дуб Гранада","Mazarri Дуб Гранада"
1905,"доска Mazarri Дуб Витория","Mazarri Дуб Витория"
1906,"доска Mazarri Дуб Мурсия","Mazarri Дуб Мурсия"
1907,"доска Mazarri Дуб Аликанте","Mazarri Дуб Аликанте"
1908,"доска Mazarri Дуб Толедо","Mazarri Дуб Толедо"
1909,"доска Greenline Дуб Мадрид","Greenline Дуб Мадрид"
1910,"доска Greenline Дуб Капри","Greenline Дуб Капри"
1911,"доска Mercier Канадский Твердый Умеренно-коричневый","Mercier Канадский Твердый Умеренно-коричневый"
1912,"доска Mercier Канадский Твердый Калахари","Mercier Канадский Твердый Калахари"
1913,"доска Mercier Канадский Твердый Мистически-коричневый","Mercier Канадский Твердый Мистически-коричневый"
1914,"доска Mercier Канадский Твердый Портобелло","Mercier Канадский Твердый Портобелло"
1915,"доска Mercier Канадский Твердый Клен Тень","Mercier Канадский Твердый Клен Тень"
1916,"доска Mercier Канадский Твердый Клен Камень","Mercier Канадский Твердый Клен Камень"
1917,"доска Mercier Канадский Твердый Клен Кофейный-Ява","Mercier Канадский Твердый Клен Кофейный-Ява"
1918,"доска Mercier Красный дуб Умеренно-коричневый","Mercier Красный дуб Умеренно-коричневый"
1919,"доска Mercier Красный дуб Вороненая сталь","Mercier Красный дуб Вороненая сталь"
1920,"доска Mercier Красный дуб Выбеленный","Mercier Красный дуб Выбеленный"
1921,"доска Mercier Красный дуб Затмение","Mercier Красный дуб Затмение"
1922,"доска Mercier Красный дуб Камень","Mercier Красный дуб Камень"
1923,"доска Mercier Красный дуб Кофейный Ява","Mercier Красный дуб Кофейный Ява"
1924,"доска Mercier Красный дуб Медовый","Mercier Красный дуб Медовый"
1925,"доска Mercier Красный дуб Натуральный","Mercier Красный дуб Натуральный"
1926,"доска Mercier Красный дуб Мистически Коричневый","Mercier Красный дуб Мистически Коричневый"
1928,"доска Mercier Красный дуб Шоколад","Mercier Красный дуб Шоколад"
1927,"доска Mercier Красный дуб Тень","Mercier Красный дуб Тень"
1929,"доска Mercier Красный дуб Каменно-Коричневый","Mercier Красный дуб Каменно-Коричневый"
1930,"доска Boen-Hohns Дуб Coral","Boen-Hohns Дуб Coral"
1931,"доска Boen-Hohns Дуб Sand","Boen-Hohns Дуб Sand"
1932,"доска Boen-Hohns Дуб Nature","Boen-Hohns Дуб Nature"
1933,"доска Boen-Hohns Дуб Traditional","Boen-Hohns Дуб Traditional"
1934,"доска Boen-Hohns Дуб Antique","Boen-Hohns Дуб Antique"
1935,"доска Boen-Hohns Дуб Pearl","Boen-Hohns Дуб Pearl"
1936,"доска Boen-Hohns Дуб Traditional белый","Boen-Hohns Дуб Traditional белый"
1937,"доска Boen-Hohns Дуб Sand","Boen-Hohns Дуб Sand"
1939,"доска Boen-Hohns Дуб Stonewashed Old Grey","Boen-Hohns Дуб Stonewashed Old Grey"
1938,"доска Boen-Hohns Дуб Coral","Boen-Hohns Дуб Coral"
1953,"доска Progress Ристретто","Progress Ристретто"
1952,"доска Progress Вербье","Progress Вербье"
1954,"доска Progress Смокед","Progress Смокед"
1955,"доска Progress Андерматт","Progress Андерматт"
1956,"доска Progress Лейкербад","Progress Лейкербад"
1958,"доска Progress Мюррен","Progress Мюррен"
1957,"доска Progress Маджоре","Progress Маджоре"
1959,"доска Progress Пинью","Progress Пинью"
1960,"доска Progress Сен-Бернар","Progress Сен-Бернар"
1961,"доска Progress Эдельвейс","Progress Эдельвейс"
1962,"доска Progress Маттерхорн","Progress Маттерхорн"
1963,"доска Progress Люциария","Progress Люциария"
1964,"доска Progress Амаретто","Progress Амаретто"
1965,"доска Progress Глетчер","Progress Глетчер"
1966,"доска Progress Карбаро","Progress Карбаро"
1967,"доска Progress Невшатель","Progress Невшатель"
1968,"доска Progress Пилатус","Progress Пилатус"
1969,"доска Progress Романдия","Progress Романдия"
1970,"доска Progress Шварцбрюке","Progress Шварцбрюке"
1973,"доска Marco Ferutti Hermitage - Дуб Грей","Marco Ferutti Hermitage - Дуб Грей"
1975,"доска Marco Ferutti Hermitage - Дуб Коньяк","Marco Ferutti Hermitage - Дуб Коньяк"
1976,"доска Marco Ferutti Hermitage - Дуб Натур","Marco Ferutti Hermitage - Дуб Натур"
1972,"доска Marco Ferutti Hermitage - Дуб Беленый","Marco Ferutti Hermitage - Дуб Беленый"
1974,"доска Marco Ferutti Hermitage - Дуб Клауд","Marco Ferutti Hermitage - Дуб Клауд"
1977,"доска Marco Ferutti Linea - Дуб Арктик браш","Marco Ferutti Linea - Дуб Арктик браш"
1978,"доска Marco Ferutti Linea - Мербау натур","Marco Ferutti Linea - Мербау натур"
1979,"доска Marco Ferutti Linea - Клен канадский","Marco Ferutti Linea - Клен канадский"
1971,"доска Marco Ferutti Hermitage - Дуб Арктик","Marco Ferutti Hermitage - Дуб Арктик"
1980,"доска Marco Ferutti Linea - Дуб Неро","Marco Ferutti Linea - Дуб Неро"
1981,"доска Marco Ferutti Linea - Дуб Грей браш","Marco Ferutti Linea - Дуб Грей браш"
1982,"доска Marco Ferutti Versailles - Дуб грей","Marco Ferutti Versailles - Дуб грей"
1984,"доска Tavolini Floors Дуб Etna","Tavolini Floors Дуб Etna"
1983,"доска Marco Ferutti Versailles - Дуб  Неро","Marco Ferutti Versailles - Дуб  Неро"
1986,"доска Tavolini Floors Дуб Notte","Tavolini Floors Дуб Notte"
1985,"доска Tavolini Floors Дуб Monaco","Tavolini Floors Дуб Monaco"
1987,"доска Tavolini Floors Дуб Dante","Tavolini Floors Дуб Dante"
1988,"доска Tavolini Floors Дуб Bruno","Tavolini Floors Дуб Bruno"
1989,"доска Tavolini Floors Дуб Monte","Tavolini Floors Дуб Monte"
1990,"доска Tavolini Floors Дуб Luna","Tavolini Floors Дуб Luna"
1991,"доска Tavolini Floors Дуб Carta","Tavolini Floors Дуб Carta"
1992,"доска Tavolini Floors Дуб Sole","Tavolini Floors Дуб Sole"
1995,"доска Ribadao Афзелия","Ribadao Афзелия"
1993,"доска Tavolini Floors Дуб Fresco","Tavolini Floors Дуб Fresco"
1996,"доска Ribadao Ипе","Ribadao Ипе"
1997,"доска Ribadao Венге","Ribadao Венге"
1998,"доска Amigo Бамбук Бордо Click","Amigo Бамбук Бордо Click"
2001,"доска Amigo Бамбук Марсель Click","Amigo Бамбук Марсель Click"
2005,"доска Amigo Бамбук Ривьера Click","Amigo Бамбук Ривьера Click"
2006,"доска Jackson Flooring Калахари","Jackson Flooring Калахари"
2007,"доска Jackson Flooring Натур","Jackson Flooring Натур"
2008,"доска Jackson Flooring Кофе","Jackson Flooring Кофе"
2009,"доска Jackson Flooring Венге","Jackson Flooring Венге"
2010,"доска Jackson Flooring Айсберг","Jackson Flooring Айсберг"
2011,"доска Jackson Flooring Мускат","Jackson Flooring Мускат"
2012,"доска Jackson Flooring Конго","Jackson Flooring Конго"
2013,"доска Amigo Бамбук Скандик","Amigo Бамбук Скандик"
2015,"доска Amigo Бамбук Гранд Каньон","Amigo Бамбук Гранд Каньон"
2014,"доска Amigo Бамбук Зебра","Amigo Бамбук Зебра"
2016,"доска Amigo Бамбук Натур","Amigo Бамбук Натур"
2017,"доска Amigo Бамбук Ориноко","Amigo Бамбук Ориноко"
2018,"доска Amigo Дуб Гасконь","Amigo Дуб Гасконь"
2020,"доска Amigo Дуб Маренго","Amigo Дуб Маренго"
2019,"доска Amigo Дуб Лимож","Amigo Дуб Лимож"
2021,"доска Amigo Дуб Сильвер Мун","Amigo Дуб Сильвер Мун"
2022,"доска Amigo Дуб Каштан","Amigo Дуб Каштан"
2023,"доска Amigo Дуб Старый замок","Amigo Дуб Старый замок"
2024,"доска Amigo Дуб Миндаль","Amigo Дуб Миндаль"
2025,"доска Greenline Дуб Неаполь","Greenline Дуб Неаполь"
2026,"доска Greenline Дуб Сицилия","Greenline Дуб Сицилия"
2027,"доска Greenline Дуб Палермо","Greenline Дуб Палермо"
2029,"доска Greenline Дуб Верона","Greenline Дуб Верона"
2028,"доска Greenline Дуб Венеция","Greenline Дуб Венеция"
2030,"доска Greenline Дуб Майорка","Greenline Дуб Майорка"
2031,"доска Greenline Дуб Леон","Greenline Дуб Леон"
2032,"доска Greenline Дуб Севилья","Greenline Дуб Севилья"
2033,"доска Greenline Дуб Барселона","Greenline Дуб Барселона"
2035,"доска Greenline Дуб Гранада","Greenline Дуб Гранада"
2036,"доска Greenline Дуб Витория","Greenline Дуб Витория"
2038,"доска Amber Wood Ясень Натур 18х120х300-1800","Amber Wood Ясень Натур 18х120х300-1800"
2037,"доска Greenline Дуб Мурсия","Greenline Дуб Мурсия"
2040,"доска Amber Wood Ясень Винтаж 18х120х300-1800","Amber Wood Ясень Винтаж 18х120х300-1800"
2039,"доска Amber Wood Ясень Ваниль 18х120х300-1800","Amber Wood Ясень Ваниль 18х120х300-1800"
2041,"доска Amber Wood Ясень Коттедж браш 18х120х300-1800","Amber Wood Ясень Коттедж браш 18х120х300-1800"
2042,"доска Amber Wood Ясень Белая ночь 18х120х300-1800","Amber Wood Ясень Белая ночь 18х120х300-1800"
2043,"доска Amber Wood Ясень Слоновая кость","Amber Wood Ясень Слоновая кость"
2044,"доска Amber Wood Ясень Капучино","Amber Wood Ясень Капучино"
2045,"доска Amber Wood Ясень Карамель 18х120х300-1800","Amber Wood Ясень Карамель 18х120х300-1800"
