2801,427,"Паркетная доска Karelia Ясень full plank 138 Story Mint"
2812,427,"Паркетная доска Karelia Ясень full plank 138 Blue Lily"
2834,427,"Паркетная доска Karelia Ясень full plank 138 Pale Peach"
2914,427,"Паркетная доска Karelia Ясень full plank 138 Story Pink Primrose"
3076,427,"Террасная доска Удерживающая скоба terazza, 20 шт"
3078,427,"Террасная доска Заглушки paseo 50шт."
3077,427,"Террасная доска Лаги монтажные из ДПК"
3079,427,"Террасная доска Нащельник terazza 4м"
3080,427,"Террасная доска Резиновая подушка terazza 100х100мм, 50шт"
3081,427,"Террасная доска Заглушки terraza 50шт."
3083,427,"Террасная доска Клема - Белый клен"
3084,427,"Террасная доска Торцовочная рейка terazza 4м"
3085,427,"Террасная доска Опорный ригель terazza 4м"
3086,427,"Террасная доска Клема - Красная"
3087,427,"Террасная доска Профиль paseo 6м"
3088,427,"Террасная доска Монтажные клипсы paseo, 50шт."
3089,427,"Террасная доска Профиль terraza 6м"
4172,427,"Экзотический паркет  Дуб золотой"
6321,427,"Паркетная доска Karelia Береза Ruska 1200/600/300"
6322,427,"Паркетная доска Karelia Береза Wirkkala 1200/600/300"
6323,427,"Паркетная доска Karelia Береза Raita 1200/600/300"
6324,427,"Паркетная доска Karelia Береза Lumi 1200/600/300"
6325,427,"Паркетная доска Karelia Береза Lumi"
6326,427,"Паркетная доска Karelia Береза Classic 1200/600/300"
6327,427,"Паркетная доска Karelia Береза Classic"
6370,427,"Террасная доска Торцевая планка из ДПК"
6371,427,"Террасная доска Профиль для примыканий terazza 4м, светлый"
6372,427,"Террасная доска Клема - Метал"
6373,427,"Террасная доска Клема - Венге"
6374,427,"Террасная доска Клема - Коричневая"
6375,427,"Террасная доска Начальный профиль terraza 4м"
6376,427,"Террасная доска Крепежная система"
6377,427,"дуб уэльский темный EI465PM"
6378,427,"пиния тоскана PI100MAA"
6379,427,"Корона -"
6380,427,1
6381,427,"Coswick -  Угольный 15x127 мм"
6382,427,"тирольский дуб, серебро EI496PM"
6383,427,"дуб аляска EI630PM"
6384,427,2
6385,427,"Coswick -  Угольный 15x127 мм"
6386,427,"дуб морской EI475PM"
6387,427,"Натуральный / Natural"
6388,427,"тирольский дуб белый EI498PM"
6389,427,"Coswick - Угольный 15x127мм CosLoc"
6699,427,"Экзотический паркет  Ятоба  1810х124х18 мм"
6709,427,"Экзотический паркет  Тигровое дерево   910х124х18"
6711,427,"Экзотический паркет  Тауари 910х125х18 мм лак"
6721,427,"Экзотический паркет  Черный американский орех   300-2000х90х18"
6722,427,"Экзотический паркет  Мербау 910х122х18"
6725,427,"Штучный паркет Вишня Вишня натур"
6726,427,"Штучный паркет Вишня Вишня селект"
6769,427,"Экзотический паркет  Окан 910х122х18 лак"
220,435,"Французская елка Дуб Натуральный"
224,435,"Французская елка Дуб Elba"
225,435,"Французская елка Дуб Imperial"
226,435,"Французская елка Дуб Siena"
227,435,"Французская елка Дуб Lido"
228,435,"Французская елка Дуб Verona"
229,435,"Французская елка Дуб Murano"
230,435,"Дуб - Молочный шоколад"
231,435,"Дуб - Шамбор"
232,435,"Дуб - Пастель"
233,435,"Дуб - Натуральный"
234,435,"Ясень - Французская Ривьера"
235,435,"Ясень - Лунный свет"
236,435,"Ясень - Жемчужный"
237,435,"Дуб - Молочный шоколад"
238,435,"Дуб - Шамбор"
239,435,"Дуб - Пастель"
240,435,"Дуб - Натуральный"
241,435,"Французcкая елка Louvre Орех Американский"
242,435,"Французcкая елка Louvre дуб Арктик"
243,435,"Французcкая елка Louvre дуб Беленый браш"
244,435,"Французcкая елка Louvre дуб Клауд браш"
245,435,"Французcкая елка Louvre дуб Коньяк"
246,435,"Ясень - Французская Ривьера"
358,437,Термоясень
359,437,Термоясень
360,437,Термоясень
361,437,"Тик для ванной"
362,437,"Тик для ванной"
363,437,"Тик для ванной"
364,437,"Тик для ванной"
365,437,"Тик палуба с герметиком"
366,437,"Робиния (Акация) с резиновыми вставками"
367,437,"Тик с резиновыми вставками"
404,438,"Фальшбалка Фальшбалки декор Дуб Черный"
405,438,"Фальшбалка Фальшбалки декор Дуб Черный Антик"
406,438,"Фальшбалка Фальшбалки декор Дуб Красный"
407,438,"Фальшбалка Фальшбалки декор Лиственница Капучино"
408,438,"Фальшбалка Фальшбалки декор Лиственница Тобакко"
409,438,"Фальшбалка Фальшбалки декор Лиственница Антик Темный"
473,440,"Имитация бруса"
474,440,"Имитация бруса"
475,440,"Вагонка косая"
476,440,Евровагонка
477,440,Планкен
478,440,Планкен
479,440,"Вагонка косая"
480,440,Меранти
1239,447,"Террасная доска Татачуба"
1240,447,"Террасная доска Татачуба"
1241,447,"Террасная доска Татачуба"
1807,435,"Французcкая елка Louvre Орех Американский"
2229,435,"Орех - Натуральный, селектэнд Беттер"
2238,435,"Орех -  Натуральный, традишинал"
2296,435,"Ясень - Лунный свет"
2297,435,"Ясень - Жемчужный"
2801,448,"Паркетная доска Karelia Ясень full plank 138 Story Mint"
2812,448,"Паркетная доска Karelia Ясень full plank 138 Blue Lily"
2834,448,"Паркетная доска Karelia Ясень full plank 138 Pale Peach"
2914,448,"Паркетная доска Karelia Ясень full plank 138 Story Pink Primrose"
3076,448,"Террасная доска Удерживающая скоба terazza, 20 шт"
3078,448,"Террасная доска Заглушки paseo 50шт."
3077,448,"Террасная доска Лаги монтажные из ДПК"
3079,448,"Террасная доска Нащельник terazza 4м"
3080,448,"Террасная доска Резиновая подушка terazza 100х100мм, 50шт"
3081,448,"Террасная доска Заглушки terraza 50шт."
3083,448,"Террасная доска Клема - Белый клен"
3084,448,"Террасная доска Торцовочная рейка terazza 4м"
3085,448,"Террасная доска Опорный ригель terazza 4м"
3086,448,"Террасная доска Клема - Красная"
3087,448,"Террасная доска Профиль paseo 6м"
3088,448,"Террасная доска Монтажные клипсы paseo, 50шт."
3089,448,"Террасная доска Профиль terraza 6м"
4172,448,"Экзотический паркет  Дуб золотой"
6321,448,"Паркетная доска Karelia Береза Ruska 1200/600/300"
6322,448,"Паркетная доска Karelia Береза Wirkkala 1200/600/300"
6323,448,"Паркетная доска Karelia Береза Raita 1200/600/300"
6324,448,"Паркетная доска Karelia Береза Lumi 1200/600/300"
6325,448,"Паркетная доска Karelia Береза Lumi"
6326,448,"Паркетная доска Karelia Береза Classic 1200/600/300"
6327,448,"Паркетная доска Karelia Береза Classic"
6370,448,"Террасная доска Торцевая планка из ДПК"
6371,448,"Террасная доска Профиль для примыканий terazza 4м, светлый"
6372,448,"Террасная доска Клема - Метал"
6373,448,"Террасная доска Клема - Венге"
6374,448,"Террасная доска Клема - Коричневая"
6375,448,"Террасная доска Начальный профиль terraza 4м"
6376,448,"Террасная доска Крепежная система"
6377,448,"дуб уэльский темный EI465PM"
6378,448,"пиния тоскана PI100MAA"
6379,448,"Корона -"
6380,448,1
6381,448,"Coswick -  Угольный 15x127 мм"
6382,448,"тирольский дуб, серебро EI496PM"
6383,448,"дуб аляска EI630PM"
6384,448,2
6385,448,"Coswick -  Угольный 15x127 мм"
6386,448,"дуб морской EI475PM"
6387,448,"Натуральный / Natural"
6388,448,"тирольский дуб белый EI498PM"
6389,448,"Coswick - Угольный 15x127мм CosLoc"
6699,448,"Экзотический паркет  Ятоба  1810х124х18 мм"
6709,448,"Экзотический паркет  Тигровое дерево   910х124х18"
6711,448,"Экзотический паркет  Тауари 910х125х18 мм лак"
6721,448,"Экзотический паркет  Черный американский орех   300-2000х90х18"
6722,448,"Экзотический паркет  Мербау 910х122х18"
6725,448,"Штучный паркет Вишня Вишня натур"
6726,448,"Штучный паркет Вишня Вишня селект"
6769,448,"Экзотический паркет  Окан 910х122х18 лак"
1,449,"Террасная доска Ипе гладкий 20х140"
2,450,"Террасная доска Тик вильвет/гладкая 19x125х1200-2400"
3,451,"Массивная доска Ribadao Оливковое дерево"
4,452,"Кожаный пол Granorte Granorte Corium Veneto Borgogna"
5,452,"Кожаный пол Granorte Granorte Corium Lombardia Antico"
6,452,"Кожаный пол Granorte Granorte Corium Toscana Ruggine"
7,452,"Кожаный пол Granorte Granorte Corium Piemonte Caffe"
8,452,"Кожаный пол Granorte Granorte Corium Veneto Seppia"
9,453,"Кожаный пол Стеновые панели Granorte Granorte Corium Veneto Borgogna"
10,453,"Кожаный пол Стеновые панели Granorte Granorte Corium Lombardia Antico"
11,453,"Кожаный пол Стеновые панели Granorte Granorte Corium Toscana Ruggine"
12,453,"Кожаный пол Стеновые панели Granorte Granorte Corium Veneto Seppia"
13,453,"Кожаный пол Стеновые панели Granorte Granorte Corium Calabria Vaniglia"
14,454,"Кожаный пол Элитер Eliter Албуфейра"
15,454,"Кожаный пол Элитер Eliter Эшторил"
16,454,"Кожаный пол Элитер Eliter Монсараш"
37,459,"Eliter Амадора"
38,459,"Eliter Браганса"
39,459,"Eliter Эвора"
40,459,"Eliter Бужио"
41,459,"Eliter Оурень"
47,461,"Wicanders Original -Natural 801"
48,461,"Wicanders Original - Rhapsody O825"
49,461,"Wicanders Original - Shell O824"
50,461,"Wicanders Original Dawn 849"
51,461,"Wicanders Original - Symphany 830"
52,462,"Wicanders TA01 Bamboo Artica"
53,462,"Wicanders TA02 Bamboo Cinamon"
54,462,"Wicanders TA03 Bamboo Laguna"
55,462,"Wicanders TA05 Bamboo Toscana"
56,462,"Wicanders TA04 Bamboo Terra"
57,463,"Wicanders RY01 Aruba"
58,463,"Wicanders Fiord White Exclusive RY 19 002"
59,463,"Wicanders Piel Nut RY1I 001"
60,463,"Wicanders Piel Aqua RY1J 001"
61,463,"Wicanders Malta Moonlight RY1N 001"
62,464,"Штучный паркет Дуб Рустик"
63,464,"Штучный паркет Дуб Натур"
64,464,"Штучный паркет Дуб Стандарт"
65,464,"Штучный паркет Дуб Радиал"
66,464,"Штучный паркет Дуб Селект радиал"
67,465,"Штучный паркет Ясень Рустик"
68,465,"Штучный паркет Ясень Стандарт"
69,465,"Штучный паркет Ясень Радиал"
70,465,"Штучный паркет Ясень Натур"
71,466,"Штучный паркет Клен Рустик"
72,466,"Штучный паркет Клен Натур"
73,466,"Штучный паркет Клен Стандарт"
74,466,"Штучный паркет Клен Радиал"
75,467,"Штучный паркет Орех Орех Европейский пропаренный Натур"
76,467,"Штучный паркет Орех Орех Европейский Натур"
77,467,"Штучный паркет Орех Орех Европейксий пропаренный Стандарт"
78,467,"Штучный паркет Орех Орех Европейксий Стандарт"
79,467,"Штучный паркет Орех Орех Европейский пропаренный Селект"
80,468,"Штучный паркет Экзотический Мербау L"
81,468,"Штучный паркет Экзотический Мербау M"
82,468,"Штучный паркет Экзотический Мербау D"
83,468,"Штучный паркет Экзотический Балау"
84,468,"Штучный паркет Экзотический Ормозия"
85,469,"Инженерная доска Mazarri Верона темный"
86,469,"Инженерная доска Mazarri Гордон темный"
87,469,"Инженерная доска Mazarri Верона Эстато"
88,469,"Инженерная доска Mazarri Верона светлый"
89,469,"Инженерная доска Mazarri Верона Пулито"
105,473,"Модульный паркет  М-258"
106,473,"Модульный паркет  М-257"
107,473,"Модульный паркет  М-256"
108,473,"Модульный паркет  М-243"
109,473,"Модульный паркет  М-244"
110,474,"Модульный паркет  М-199 (дуб радиал, клен)"
111,474,"Модульный паркет  М-198 (дуб радиал, клен)"
112,474,"Модульный паркет  М-200 (дуб стандарт, дуб радиал, ясень)"
113,474,"Модульный паркет  М-205 (дуб радиал, ясень, мербау)"
114,474,"Модульный паркет  М-213  (дуб радиал, ясень, мербау)"
115,475,"Модульный паркет  М-178 (дуб радиал, клен, мербау)"
116,475,"Модульный паркет  М-177 (дуб радиал, клен, орех)"
117,475,"Модульный паркет  М-176 (дуб радиал, клен, орех)"
118,475,"Модульный паркет  М-191 (дуб радиал, клен, мербау,  орех)"
119,475,"Модульный паркет  М-197 (дуб радиал, дуб стандарт, ясень, мербау)"
120,476,"Модульный паркет  М-110  дуб радиал, клен, мербау"
121,476,"Модульный паркет  М-108  дуб радиал, клен, мербау"
122,476,"Модульный паркет  М-93 ясень, мербау"
123,476,"Модульный паркет  М-109  дуб радиал, клен, мербау"
124,476,"Модульный паркет  М-124 дуб радиал, ясень, мербау"
125,477,"Модульный паркет  M-69 (дуб радиал, орех)"
126,477,"Модульный паркет  M-76 (дуб радиал, клен)"
127,477,"Модульный паркет  M-79 (дуб радиал, мербау)"
128,477,"Модульный паркет  M-70 (дуб радиал, орех)"
129,477,"Модульный паркет  M-72 (дуб радиал, мербау)"
130,478,"Модульный паркет  M-219 (дуб радиал, ясень, мербау)"
131,478,"Модульный паркет  M-221 (дуб радиал, клен, мербау)"
132,478,"Модульный паркет  M-214(дуб радиал, клен, орех)"
133,478,"Модульный паркет  M-215 (дуб радиал, клен, орех)"
134,478,"Модульный паркет  M-218 (дуб радиал, клен, орех)"
135,479,"Модульный паркет  M-146 (дуб радиал, ясень, мербау, орех)"
136,479,"Модульный паркет  M-124 (дуб радиал, ясень, мербау)"
137,479,"Модульный паркет  M-119 (дуб радиал, ясень, мербау)"
138,479,"Модульный паркет  M-120 (дуб радиал, клен, мербау)"
139,479,"Модульный паркет  M-138 (дуб радиал, клен, мербау)"
140,480,"Модульный паркет  M-45 дуб стандарт, мербау"
141,480,"Модульный паркет  M-59 дуб радиал,ясень"
142,480,"Модульный паркет  M-51 дуб радиал, ясень, мербау"
143,480,"Модульный паркет  M-44 дуб радиал, орех"
144,480,"Модульный паркет  M-46 дуб радиал, клен, ясень"
145,481,"Модульный паркет  M-226  (дуб радиал, клен, орех)"
146,481,"Модульный паркет  M-227 (дуб стандарт, клен, мербау, орех)"
147,481,"Модульный паркет  M-228 (дуб радиал, клен, мербау, орех)"
148,481,"Модульный паркет  M-232 (дуб радиал, клен, мербау, орех)"
149,481,"Модульный паркет  M-234 (дуб радиал, клен, мербау, орех)"
150,482,"Инженерная доска  Дуб арт.77-01"
151,482,"Инженерная доска Mazarri Дуб арт.77-02"
152,482,"Инженерная доска Mazarri Дуб арт.77-04"
153,482,"Инженерная доска Mazarri Дуб арт.77-05"
154,482,"Инженерная доска Mazarri Дуб арт.77-06"
160,484,"Инженерная доска Greenline Дуб Леон"
161,484,"Инженерная доска Greenline Дуб Майорка"
162,484,"Инженерная доска Greenline Дуб Севилья"
163,484,"Инженерная доска Greenline Дуб Верона"
164,484,"Инженерная доска Greenline Дуб Венеция"
165,485,"Инженерная доска Global Parquet Дуб Plum (Слива)"
166,485,"Инженерная доска Global Parquet Дуб Cream Currant (Смородина)"
167,485,"Инженерная доска Global Parquet Дуб Pine Nut (Кедровый)"
168,485,"Инженерная доска Global Parquet Дуб Peach (Персик)"
169,485,"Инженерная доска Global Parquet Дуб Raisins (Изюм)"
175,487,"Инженерная доска Mercier Канадский Твердый Клен Арабика"
176,487,"Инженерная доска Mercier Канадский Твердый Клен Шоколадный"
177,487,"Инженерная доска Mercier Канадский Твердый Клен Затмение"
178,487,"Инженерная доска Mercier Канадский Твердый Клен Каменно-Коричневый"
179,487,"Инженерная доска Mercier Канадский Твердый Клен Корица"
180,488,"Инженерная доска Missouri Collection Орех Американский натур(16х120)"
181,488,"Инженерная доска Missouri Collection Орех Американский селект(16х120)"
182,488,"Инженерная доска Missouri Collection Орех Американский натур(16х190)"
183,488,"Инженерная доска Missouri Collection Орех Американский селект(16х190)"
184,488,"Инженерная доска Missouri Collection Орех Американский натур(16х240)"
195,491,"Инженерная доска  Дуб Rhein"
196,491,"Инженерная доска  Дуб Leine"
197,491,"Инженерная доска  Дуб Ortler"
198,491,"Инженерная доска  Ясень Dunkel Payne"
199,491,"Инженерная доска  Дуб Monte Cavallo"
200,492,"Инженерная доска Progress Сахара"
201,492,"Инженерная доска Progress Британия"
202,492,"Инженерная доска Progress Церматт"
203,492,"Инженерная доска Progress Дюфур (ясень)"
204,492,"Инженерная доска Progress Эльм"
205,493,"Инженерная доска Bolefloor Дуб без покрытия"
206,493,"Инженерная доска Bolefloor Дуб"
207,493,"Инженерная доска Bolefloor Дуб"
208,493,"Инженерная доска Bolefloor Дуб"
209,494,"Инженерная доска Doms Lack"
210,494,"Инженерная доска Doms Grey"
211,494,"Инженерная доска Doms Vagnila"
212,494,"Инженерная доска Doms Noce"
213,494,"Инженерная доска Doms Nougat"
214,495,"Инженерная доска Wood Bee Дуб Натур Браш"
215,495,"Инженерная доска Wood Bee Дуб Коньяк"
216,495,"Инженерная доска Wood Bee Ясень Коньяк"
217,495,"Инженерная доска Wood Bee Дуб Селект"
218,495,"Инженерная доска Wood Bee Дуб Вайт"
247,497,"Паркетная доска Greenline Дуб Натур"
248,497,"Паркетная доска Greenline Дуб Селект"
249,497,"Паркетная доска Greenline Дуб Кофе"
250,497,"Паркетная доска Greenline Дуб Антик"
251,497,"Паркетная доска Greenline Дуб Карамель"
252,498,"Паркетная доска Mazarri Ясень Коньяк"
253,498,"Паркетная доска Mazarri Ясень Какао"
254,498,"Паркетная доска Mazarri Ясень Антик"
255,498,"Паркетная доска Mazarri Ясень Песочный"
256,498,"Паркетная доска Mazarri Дуб Коньяк"
257,499,"Паркетная доска Polarwood Дуб Ливинг"
258,499,"Паркетная доска Polarwood Ясень Ливинг"
259,499,"Паркетная доска Polarwood Дуб Коттедж"
260,499,"Паркетная доска Polarwood Дуб Венера"
261,499,"Паркетная доска Polarwood Дуб Тундра"
267,501,"Паркетная доска Amber Wood Ясень Миндаль"
268,501,"Паркетная доска Amber Wood Ясень Бурбон"
269,501,"Паркетная доска Amber Wood Ясень Махагон"
270,501,"Паркетная доска Amber Wood Ясень Шампань"
271,501,"Паркетная доска Amber Wood Ясень Слоновая кость"
277,503,"Паркетная доска Esta Parket Ясень Antique"
278,503,"Паркетная доска Esta Parket Дуб Village(natur)"
279,503,"Паркетная доска Esta Parket Ясень Brendy"
280,503,"Паркетная доска Esta Parket Ясень Honey"
281,503,"Паркетная доска Esta Parket Ясень Rose"
282,504,"Паркетная доска FocusFloor Дуб Либецио (LIBECCIO)"
283,504,"Паркетная доска FocusFloor Дуб Хамсин (KHAMSIN)"
285,504,"Паркетная доска FocusFloor Дуб Сирокко (SIROCCO)"
284,504,"Паркетная доска FocusFloor Дуб Лодос (LODOS)"
286,504,"Паркетная доска FocusFloor Ясень Мистраль (MISTRAL)"
302,508,"Паркетная доска Wood Bee Дуб Антик Блэк Стори"
303,508,"Паркетная доска Wood Bee Бамбук Кофе"
304,508,"Паркетная доска Wood Bee Бамбук Натур"
305,508,"Паркетная доска Wood Bee Дуб Вулканик"
306,508,"Паркетная доска Wood Bee Дуб натур Браш"
322,512,"Паркетная доска Universal Гевея Прайм"
323,512,"Паркетная доска Universal Гевея Прайм красная"
324,512,"Паркетная доска Universal Дуб Прайм"
325,512,"Паркетная доска Universal Дуб Прайм Мраморный"
326,512,"Паркетная доска Universal Дуб прайм термо"
332,514,"Паркетная доска Old Wood Дуб Шоколад рустик"
333,514,"Паркетная доска Old Wood Дуб Натуральный"
334,514,"Паркетная доска Old Wood Ясень Крем белый"
335,514,"Паркетная доска Old Wood Ясень Шоколад ТЕРМО"
336,514,"Паркетная доска Old Wood Дуб Карамель"
