6543,873,"Ламинат Witex Дуб Шведский Дымчатый EI 110 BV2"
6544,854,"Ламинат Witex Яблоня Ностальгия AP 100 MC"
6546,855,"Ламинат Witex Дуб Темный EI 350MMV2"
6545,848,"Ламинат Witex Ламинат Сырая Сталь Матовый CHC 660 CM"
6547,875,"Ламинат Witex Бетон  S 310 MSV4"
6548,865,"Ламинат Witex Дуб  Тирольский Охра  EI 499MV2"
6549,856,"Ламинат Progress Трикотаж 9 - 308"
6550,847,"Ламинат Progress Лава - 119"
6551,869,"Ламинат Witex Дуб Уэльский Светлый  EI 445PM"
6552,848,"Ламинат Witex Ламинат Венге Оригинал Матовый CHC 650 CM"
6553,847,"Ламинат Progress Металлический камень - 121"
6554,859,"Ламинат Witex Орех Антрацит NU 300P"
6555,847,"Ламинат Progress Котто - 103"
6556,852,"Ламинат Pergo Дуб светлый распиленный, планка (L0201-01808)"
6558,841,"Ламинат Pergo Современный дуб серый, планка 4V (L0323-01753)"
6557,850,"Ламинат Pergo Дуб обыкновенный, 2-полосный (L0101-01797)"
6559,875,"Ламинат Witex Креатив Ржавчина P 975 MSV4"
6560,842,"Ламинат Progress Яблоня -  242"
6561,873,"Ламинат Witex Дуб Шотландский EI 255 BV2"
6562,861,"Ламинат Pergo Контур серебристый (L0518-01845)"
6563,843,"Ламинат Witex Дуб Вирджиния EI 920M"
6564,853,"Ламинат Progress Velour 5 - 504"
6565,855,"Ламинат Witex Дуб Мичиган EI 370MMV2"
6566,842,"Ламинат Progress Дуб состареннный -  213"
6567,869,"Ламинат Witex Дуб Тирольский Серебро EI 496PM"
6568,841,"Ламинат Pergo Северный дуб, планка 2V (L0305-01771)"
6570,852,"Ламинат Pergo Дуб натуральный, планка (L0201-01804)"
6569,850,"Ламинат Pergo Дуб термо, планка (L0101-01803)"
6571,852,"Ламинат Pergo Дуб серебряный, планка (L0201-01807)"
6572,852,"Ламинат Pergo Дуб цельный, 3-полосный (L0201-01790)"
6573,850,"Ламинат Pergo Дуб натуральный распиленный, планка (L0101-01809)"
6574,850,"Ламинат Pergo Дуб цельный, 3-полосный (L0101-01790)"
6576,861,"Ламинат Pergo Фасетка черная (L0518-01839)"
6575,850,"Ламинат Pergo Дуб черный, планка (L0101-01806)"
6577,861,"Ламинат Pergo Декоративное золото (L0518-01842)"
6578,861,"Ламинат Pergo Декоративное серебро (L0518-01844)"
6579,850,"Ламинат Pergo Дуб осенний, планка 4V (L0123-01765)"
6580,850,"Ламинат Pergo Дуб полночь, планка 4V (L0123-01763)"
6581,850,"Ламинат Pergo Дуб пунцовый, планка 4V  (L0123-01757)"
6582,850,"Ламинат Pergo Реставрированный темный дуб 4V (L0123-01759)"
6583,850,"Ламинат Pergo Дуб серый меленый планка 4V (L0108-01812)"
6584,850,"Ламинат Pergo Дуб светлый меленый планка 4V (L0111-01815)"
6585,841,"Ламинат Pergo Орех 3-полосный (L0301-01791)"
6586,841,"Ламинат Pergo Меленый светлый распиленный, планка 2V (L0304-01808)"
6587,841,"Ламинат Pergo Дуб термо, планка 2V (L0304-01803)"
6588,841,"Ламинат Pergo Мербау, планка 2V (L0304-01599)"
6589,841,"Ламинат Pergo Мербау морской, планка 2V (L0310-01599)"
6590,841,"Ламинат Pergo Реставрированный темный дуб, планка 4V (L0323-01759)"
6591,841,"Ламинат Pergo Старинный дуб, планка 2V (L0305-01775)"
6592,841,"Ламинат Pergo Дуб эбен, планка 4V (L0311-01818)"
6593,841,"Ламинат Pergo Мербау, планка  4V (L0311-01599)"
6594,841,"Ламинат Pergo Серый бетон Big Slab(L0318-01782)"
6595,852,"Ламинат Pergo Дуб натуральный, планка 2V (L0204-01804)"
6596,852,"Ламинат Pergo Дуб термо, планка 2V (L0204-01803)"
6597,852,"Ламинат Pergo Дуб черный, планка 2V (L0204-01806)"
6598,852,"Ламинат Pergo Плита белая Big Slab (L0218-01783)"
6599,852,"Ламинат Pergo Сланец альпака Big Slab 4V (L0220-01781)"
6600,852,"Ламинат Pergo Сланец светло-серый Big Slab 4V (L0220-01780)"
6601,852,"Ламинат Pergo Сланец темно-серый Big Slab 4V(L0220-01778)"
6602,850,"Ламинат Pergo Северный дуб, планка 2V (L0105-01771)"
6603,850,"Ламинат Pergo Дуб эбен, планка 4V (L0111-01818)"
6604,873,"Ламинат Witex Дуб Мореный EI 120 BV2"
6605,842,"Ламинат Progress Дуб узловатый -  208"
6606,852,"Ламинат Pergo Дуб темно-серый, планка 2V (L0205-01770)"
6607,852,"Ламинат Pergo Дуб темно-серый меленый, планка 4V (L0208-01811)"
6608,841,"Ламинат Pergo Сланец светло-серый Big Slab 4V (L0320-01780)"
6609,852,"Ламинат Pergo Дуб Вороненый, планка 4V (L0211-01817)"
6610,852,"Ламинат Pergo Дуб серебряный, планка 4V (L0211-01807)"
6611,850,"Ламинат Pergo Дуб морской вороненый, планка 2V (L0110-01817)"
6612,854,"Ламинат Witex Дуб Бергамо EI 750 MC"
6614,851,"Ламинат Witex Дуб Крем EI 020 ARA"
6615,868,"Ламинат Witex Дуб Волна Темный EI 460 ERNV"
6616,847,"Ламинат Progress Зернистый камень - 106"
6617,847,"Ламинат Progress Черный камень - 115"
6618,847,"Ламинат Progress Белый камень - 116"
6619,847,"Ламинат Progress Цемент темный - 117"
6620,847,"Ламинат Progress Индийский сланец- 118"
6621,847,"Ламинат Progress Каменный металлик - 122"
6622,847,"Ламинат Progress Камень оксид - 124"
6623,847,"Ламинат Progress Темный сланец - 126"
6624,856,"Ламинат Progress Трикотаж 4 - 303"
6625,856,"Ламинат Progress Трикотаж 7 - 306"
6626,856,"Ламинат Progress Трикотаж 8 - 307"
6627,842,"Ламинат Progress Ель состаренная натур -  206"
6628,842,"Ламинат Progress Арве натур -  210"
6630,842,"Ламинат Progress Кантри копченый -  212"
6629,842,"Ламинат Progress Кантри -  211"
6631,842,"Ламинат Progress Файнлайн серый -  223"
6632,871,"Ламинат Progress Сланец - 600"
6633,871,"Ламинат Progress Сланец блестящий серо-зеленый - 604"
6634,853,"Ламинат Progress Velour 4 - 503"
6635,842,"Ламинат Progress Орех горный состаренный -  234"
6636,842,"Ламинат Progress Дуб поперечный белый -  264"
6637,847,"Ламинат Progress Кремовая глина - 112"
6638,847,"Ламинат Progress Серая глина - 113"
6639,847,"Ламинат Progress Глина оксид - 114"
6640,875,"Ламинат Witex Бетон Темный S 400 MSV4"
6641,842,"Ламинат Progress Кедр -  233"
6642,843,"Ламинат Witex Дуб Амбиенс Кремовый EI 820M"
6643,865,"Ламинат Witex Дуб  Тирольский Белый EI 498MV2"
6644,857,"Ламинат Witex Орех Антрацит NU 300 PC"
6645,875,"Ламинат Witex Креатив Грей P 980 MSV4"
6646,848,"Ламинат Witex Кость Матовый CHC 670 CM"
6648,868,"Ламинат Witex Дуб Волна Кремовый EI 450 ERNV"
6647,862,"Ламинат HDM Elesgo Орех грецкий"
6649,859,"Ламинат Witex Дуб Волна Серый EI 130P"
6650,867,"Ламинат Witex Акация AC 610 ERA"
6651,851,"Ламинат Witex Вишня Мускат EI 090 ARA"
6652,851,"Ламинат Witex Венге Какао WE 010 ARA"
6653,873,"Ламинат Witex Пекан Американский PE 100 BV2"
6654,848,"Ламинат Witex Рубиново-красный Матовый CHC 540 CM"
6655,867,"Ламинат Witex Дуб кантри EI330ERA"
6656,867,"Ламинат Witex Сосна трентино KI310ERA"
6657,867,"Ламинат Witex Орех  баланс NU310ERA"
6658,867,"Ламинат Witex Сосна сардиния PI310ERA"
6659,867,"Ламинат Witex Тик кремовый TE320ERA"
6660,868,"Ламинат Witex Дуб Волна  Серый EI 130 ERNV"
6661,868,"Ламинат Witex Дуб Мичиган EI 370 ERNV"
6662,868,"Ламинат Witex Дуб Онтарио EI 375 ERNV"
6663,868,"Ламинат Witex Дуб Желтый EI 160 ERNV"
6664,868,"Ламинат Witex Дуб Европейский EI 170E RNV"
6665,854,"Ламинат Witex Пекан Американский  PE 100 MC"
6666,843,"Ламинат Witex Яблоня Ностальгия AP100M"
6667,843,"Ламинат Witex Бамбук Стреловидный BA 120M"
6668,843,"Ламинат Witex Орех Классик NU 250M"
6669,843,"Ламинат Witex Пекан Американский PE 100M"
6670,843,"Ламинат Witex Панга-Панга PP 300M"
6671,843,"Ламинат Witex Вишня Каван KB 310M"
6672,865,"Ламинат Witex Дуб Грецкий Орех EI 335MV2"
6673,865,"Ламинат Witex Дуб Тирольский Крем EI 491MV2"
6674,865,"Ламинат Witex Дуб Крепостной  EI 105MV2"
6675,875,"Ламинат Witex Травертин Кремовый P 965 MSV4"
6676,875,"Ламинат Witex Камень Вулканический P 985 MSV4"
6678,860,"Ламинат Witex Дуб Ностальгический EI 920 MXLV4"
6677,875,"Ламинат Witex Черный Сланец S 300 MSV4"
6679,860,"Ламинат Witex Дуб Теннесси Белый EI 102 MXLV4"
6680,860,"Ламинат Witex Дуб Асьенда EI 490 MXLV4"
6681,860,"Ламинат Witex Дуб Теннесси Натуральный EI 101 MXLV4"
6682,860,"Ламинат Witex Дуб Теннесси Платина EI 107 MXLV4"
6683,859,"Ламинат Witex Клен Аргентинский AH 315P"
6684,859,"Ламинат Witex Афзелия  Африканская AF 100P"
6685,859,"Ламинат Witex Дуб Белый EI 410P"
6686,859,"Ламинат Witex Бук Колумбийский BU 305P"
6687,857,"Ламинат Witex Афзелия Африканская AF 100 PC"
6688,869,"Ламинат Witex Дуб Тирольский EI 495PM"
6690,869,"Ламинат Witex Дуб Аляска EI 630PM"
6689,869,"Ламинат Witex Дуб Тирольский Белый EI 498PM"
6691,855,"Ламинат Witex Дуб Шампанское EI 325MMV2"
6692,855,"Ламинат Witex Дуб Грецкий Орех EI 335MMV2"
6693,870,"Ламинат HDM Elesgo Бамбук кофе"
6694,870,"Ламинат HDM Elesgo Орех грецкий"
6695,870,"Ламинат HDM Elesgo Рио палисандер"
6696,862,"Ламинат HDM Elesgo Черный"
6697,862,"Ламинат HDM Elesgo Вишня горная"
6698,846,"Ламинат HDM Elesgo Песчаник"
6700,883,"Массивная доска Tavolini Floors Дуб Neve"
1570,762,"Средство по уходу за террасной доской (тёмные породы)"
1703,776,"Инженерная доска Siberian Floor Дуб Черный, патина серебро, лак УФ"
2663,708,"Паркетная доска Upofloor Дуб Классик Браун СЛ 2,0/2,2м2/уп. 1-полосный"
3040,814,"Паркетная доска Boen-Hohns Орех американский Andante масло"
2663,708,"Паркетная доска Upofloor Дуб Классик Браун СЛ 2,0/2,2м2/уп. 1-полосный"
3040,814,"Паркетная доска Boen-Hohns Орех американский Andante масло"
2663,708,"Паркетная доска Upofloor Дуб Классик Браун СЛ 2,0/2,2м2/уп. 1-полосный"
3040,814,"Паркетная доска Boen-Hohns Орех американский Andante масло"
2801,427,"Паркетная доска Karelia Ясень full plank 138 Story Mint"
2812,427,"Паркетная доска Karelia Ясень full plank 138 Blue Lily"
2834,427,"Паркетная доска Karelia Ясень full plank 138 Pale Peach"
2914,427,"Паркетная доска Karelia Ясень full plank 138 Story Pink Primrose"
3076,427,"Террасная доска Удерживающая скоба terazza, 20 шт"
3078,427,"Террасная доска Заглушки paseo 50шт."
3077,427,"Террасная доска Лаги монтажные из ДПК"
3079,427,"Террасная доска Нащельник terazza 4м"
3080,427,"Террасная доска Резиновая подушка terazza 100х100мм, 50шт"
3081,427,"Террасная доска Заглушки terraza 50шт."
3083,427,"Террасная доска Клема - Белый клен"
3084,427,"Террасная доска Торцовочная рейка terazza 4м"
3085,427,"Террасная доска Опорный ригель terazza 4м"
3086,427,"Террасная доска Клема - Красная"
3087,427,"Террасная доска Профиль paseo 6м"
3088,427,"Террасная доска Монтажные клипсы paseo, 50шт."
3089,427,"Террасная доска Профиль terraza 6м"
4172,427,"Экзотический паркет  Дуб золотой"
6321,427,"Паркетная доска Karelia Береза Ruska 1200/600/300"
6322,427,"Паркетная доска Karelia Береза Wirkkala 1200/600/300"
6323,427,"Паркетная доска Karelia Береза Raita 1200/600/300"
6324,427,"Паркетная доска Karelia Береза Lumi 1200/600/300"
6325,427,"Паркетная доска Karelia Береза Lumi"
6326,427,"Паркетная доска Karelia Береза Classic 1200/600/300"
6327,427,"Паркетная доска Karelia Береза Classic"
6370,427,"Террасная доска Торцевая планка из ДПК"
6371,427,"Террасная доска Профиль для примыканий terazza 4м, светлый"
6372,427,"Террасная доска Клема - Метал"
6373,427,"Террасная доска Клема - Венге"
6374,427,"Террасная доска Клема - Коричневая"
6375,427,"Террасная доска Начальный профиль terraza 4м"
6376,427,"Террасная доска Крепежная система"
6377,427,"дуб уэльский темный EI465PM"
6378,427,"пиния тоскана PI100MAA"
6379,427,"Корона -"
6380,427,1
6381,427,"Coswick -  Угольный 15x127 мм"
6382,427,"тирольский дуб, серебро EI496PM"
6383,427,"дуб аляска EI630PM"
6384,427,2
6385,427,"Coswick -  Угольный 15x127 мм"
6386,427,"дуб морской EI475PM"
6387,427,"Натуральный / Natural"
6388,427,"тирольский дуб белый EI498PM"
6389,427,"Coswick - Угольный 15x127мм CosLoc"
6699,427,"Экзотический паркет  Ятоба  1810х124х18 мм"
6709,427,"Экзотический паркет  Тигровое дерево   910х124х18"
6711,427,"Экзотический паркет  Тауари 910х125х18 мм лак"
6721,427,"Экзотический паркет  Черный американский орех   300-2000х90х18"
6722,427,"Экзотический паркет  Мербау 910х122х18"
6725,427,"Штучный паркет Вишня Вишня натур"
6726,427,"Штучный паркет Вишня Вишня селект"
6769,427,"Экзотический паркет  Окан 910х122х18 лак"
220,435,"Французская елка Дуб Натуральный"
224,435,"Французская елка Дуб Elba"
225,435,"Французская елка Дуб Imperial"
226,435,"Французская елка Дуб Siena"
227,435,"Французская елка Дуб Lido"
228,435,"Французская елка Дуб Verona"
229,435,"Французская елка Дуб Murano"
230,435,"Дуб - Молочный шоколад"
231,435,"Дуб - Шамбор"
232,435,"Дуб - Пастель"
233,435,"Дуб - Натуральный"
234,435,"Ясень - Французская Ривьера"
235,435,"Ясень - Лунный свет"
236,435,"Ясень - Жемчужный"
237,435,"Дуб - Молочный шоколад"
238,435,"Дуб - Шамбор"
239,435,"Дуб - Пастель"
240,435,"Дуб - Натуральный"
241,435,"Французcкая елка Louvre Орех Американский"
242,435,"Французcкая елка Louvre дуб Арктик"
243,435,"Французcкая елка Louvre дуб Беленый браш"
244,435,"Французcкая елка Louvre дуб Клауд браш"
245,435,"Французcкая елка Louvre дуб Коньяк"
246,435,"Ясень - Французская Ривьера"
358,437,Термоясень
359,437,Термоясень
360,437,Термоясень
361,437,"Тик для ванной"
362,437,"Тик для ванной"
363,437,"Тик для ванной"
364,437,"Тик для ванной"
365,437,"Тик палуба с герметиком"
366,437,"Робиния (Акация) с резиновыми вставками"
367,437,"Тик с резиновыми вставками"
404,438,"Фальшбалка Фальшбалки декор Дуб Черный"
405,438,"Фальшбалка Фальшбалки декор Дуб Черный Антик"
406,438,"Фальшбалка Фальшбалки декор Дуб Красный"
407,438,"Фальшбалка Фальшбалки декор Лиственница Капучино"
408,438,"Фальшбалка Фальшбалки декор Лиственница Тобакко"
409,438,"Фальшбалка Фальшбалки декор Лиственница Антик Темный"
473,440,"Имитация бруса"
474,440,"Имитация бруса"
475,440,"Вагонка косая"
476,440,Евровагонка
477,440,Планкен
478,440,Планкен
479,440,"Вагонка косая"
480,440,Меранти
1239,447,"Террасная доска Татачуба"
1240,447,"Террасная доска Татачуба"
1241,447,"Террасная доска Татачуба"
1807,435,"Французcкая елка Louvre Орех Американский"
2229,435,"Орех - Натуральный, селектэнд Беттер"
2238,435,"Орех -  Натуральный, традишинал"
2296,435,"Ясень - Лунный свет"
2297,435,"Ясень - Жемчужный"
2801,448,"Паркетная доска Karelia Ясень full plank 138 Story Mint"
2812,448,"Паркетная доска Karelia Ясень full plank 138 Blue Lily"
2834,448,"Паркетная доска Karelia Ясень full plank 138 Pale Peach"
2914,448,"Паркетная доска Karelia Ясень full plank 138 Story Pink Primrose"
3076,448,"Террасная доска Удерживающая скоба terazza, 20 шт"
3078,448,"Террасная доска Заглушки paseo 50шт."
3077,448,"Террасная доска Лаги монтажные из ДПК"
3079,448,"Террасная доска Нащельник terazza 4м"
3080,448,"Террасная доска Резиновая подушка terazza 100х100мм, 50шт"
3081,448,"Террасная доска Заглушки terraza 50шт."
3083,448,"Террасная доска Клема - Белый клен"
3084,448,"Террасная доска Торцовочная рейка terazza 4м"
3085,448,"Террасная доска Опорный ригель terazza 4м"
3086,448,"Террасная доска Клема - Красная"
3087,448,"Террасная доска Профиль paseo 6м"
3088,448,"Террасная доска Монтажные клипсы paseo, 50шт."
3089,448,"Террасная доска Профиль terraza 6м"
4172,448,"Экзотический паркет  Дуб золотой"
6321,448,"Паркетная доска Karelia Береза Ruska 1200/600/300"
6322,448,"Паркетная доска Karelia Береза Wirkkala 1200/600/300"
6323,448,"Паркетная доска Karelia Береза Raita 1200/600/300"
6324,448,"Паркетная доска Karelia Береза Lumi 1200/600/300"
6325,448,"Паркетная доска Karelia Береза Lumi"
6326,448,"Паркетная доска Karelia Береза Classic 1200/600/300"
6327,448,"Паркетная доска Karelia Береза Classic"
6370,448,"Террасная доска Торцевая планка из ДПК"
6371,448,"Террасная доска Профиль для примыканий terazza 4м, светлый"
6372,448,"Террасная доска Клема - Метал"
6373,448,"Террасная доска Клема - Венге"
6374,448,"Террасная доска Клема - Коричневая"
6375,448,"Террасная доска Начальный профиль terraza 4м"
6376,448,"Террасная доска Крепежная система"
6377,448,"дуб уэльский темный EI465PM"
6378,448,"пиния тоскана PI100MAA"
6379,448,"Корона -"
6380,448,1
6381,448,"Coswick -  Угольный 15x127 мм"
6382,448,"тирольский дуб, серебро EI496PM"
6383,448,"дуб аляска EI630PM"
6384,448,2
6385,448,"Coswick -  Угольный 15x127 мм"
6386,448,"дуб морской EI475PM"
6387,448,"Натуральный / Natural"
6388,448,"тирольский дуб белый EI498PM"
6389,448,"Coswick - Угольный 15x127мм CosLoc"
6699,448,"Экзотический паркет  Ятоба  1810х124х18 мм"
6709,448,"Экзотический паркет  Тигровое дерево   910х124х18"
6711,448,"Экзотический паркет  Тауари 910х125х18 мм лак"
6721,448,"Экзотический паркет  Черный американский орех   300-2000х90х18"
6722,448,"Экзотический паркет  Мербау 910х122х18"
6725,448,"Штучный паркет Вишня Вишня натур"
6726,448,"Штучный паркет Вишня Вишня селект"
6769,448,"Экзотический паркет  Окан 910х122х18 лак"
1,449,"Террасная доска Ипе гладкий 20х140"
2,450,"Террасная доска Тик вильвет/гладкая 19x125х1200-2400"
3,451,"Массивная доска Ribadao Оливковое дерево"
4,452,"Кожаный пол Granorte Granorte Corium Veneto Borgogna"
5,452,"Кожаный пол Granorte Granorte Corium Lombardia Antico"
6,452,"Кожаный пол Granorte Granorte Corium Toscana Ruggine"
7,452,"Кожаный пол Granorte Granorte Corium Piemonte Caffe"
8,452,"Кожаный пол Granorte Granorte Corium Veneto Seppia"
9,453,"Кожаный пол Стеновые панели Granorte Granorte Corium Veneto Borgogna"
10,453,"Кожаный пол Стеновые панели Granorte Granorte Corium Lombardia Antico"
11,453,"Кожаный пол Стеновые панели Granorte Granorte Corium Toscana Ruggine"
12,453,"Кожаный пол Стеновые панели Granorte Granorte Corium Veneto Seppia"
13,453,"Кожаный пол Стеновые панели Granorte Granorte Corium Calabria Vaniglia"
14,454,"Кожаный пол Элитер Eliter Албуфейра"
15,454,"Кожаный пол Элитер Eliter Эшторил"
16,454,"Кожаный пол Элитер Eliter Монсараш"
37,459,"Eliter Амадора"
38,459,"Eliter Браганса"
39,459,"Eliter Эвора"
40,459,"Eliter Бужио"
41,459,"Eliter Оурень"
47,461,"Wicanders Original -Natural 801"
48,461,"Wicanders Original - Rhapsody O825"
49,461,"Wicanders Original - Shell O824"
50,461,"Wicanders Original Dawn 849"
51,461,"Wicanders Original - Symphany 830"
52,462,"Wicanders TA01 Bamboo Artica"
53,462,"Wicanders TA02 Bamboo Cinamon"
54,462,"Wicanders TA03 Bamboo Laguna"
55,462,"Wicanders TA05 Bamboo Toscana"
56,462,"Wicanders TA04 Bamboo Terra"
57,463,"Wicanders RY01 Aruba"
58,463,"Wicanders Fiord White Exclusive RY 19 002"
59,463,"Wicanders Piel Nut RY1I 001"
60,463,"Wicanders Piel Aqua RY1J 001"
61,463,"Wicanders Malta Moonlight RY1N 001"
62,464,"Штучный паркет Дуб Рустик"
63,464,"Штучный паркет Дуб Натур"
64,464,"Штучный паркет Дуб Стандарт"
65,464,"Штучный паркет Дуб Радиал"
66,464,"Штучный паркет Дуб Селект радиал"
67,465,"Штучный паркет Ясень Рустик"
68,465,"Штучный паркет Ясень Стандарт"
69,465,"Штучный паркет Ясень Радиал"
70,465,"Штучный паркет Ясень Натур"
